ISBN;Book-Title;Book-Author;Year-Of-Publication;Publisher;Genre Principal;Genres Secondaires;Image-URL-L;Moyenne_Adolescent 12-17;Moyenne_Adulte 26-35;Moyenne_Adulte 36-50;Moyenne_Enfant 1-12;Moyenne_Jeune adulte 18-25;Moyenne_Senior 50+
0446609323;Black Friday;James Patterson;1989-01-01;Warner Vision;Mystery;Fiction, Thriller, Mystery, Crime, Suspense, Thriller, Mystery Thriller, Mystery, Murder Mystery, Mystery, Detective, Action, War, Terrorism;http://images.amazon.com/images/P/0446609323.01.LZZZZZZZ.jpg;8.0;7.935483870967742;7.961538461538462;;10.0;6.928571428571429
0446609404;Cradle and All;James Patterson;2001-01-01;Warner Vision;Mystery;Fiction, Thriller, Suspense, Mystery, Crime, Horror, Thriller, Mystery Thriller, Mystery, Detective, Religion, Novels;http://images.amazon.com/images/P/0446609404.01.LZZZZZZZ.jpg;;7.970588235294118;8.09375;;6.214285714285714;8.0
0446611085;Suzanne's Diary for Nicholas;James Patterson;2003-01-01;Warner Books;Romance;Fiction, Womens Fiction, Chick Lit, Contemporary, Adult, Mystery, Adult Fiction, Drama, Love, Romance, Contemporary Romance;http://images.amazon.com/images/P/0446611085.01.LZZZZZZZ.jpg;;7.933333333333334;8.116279069767442;9.0;8.0;7.809523809523809
0446611239;The Cabinet of Curiosities;Douglas Preston;2003-01-01;Warner Books;Mystery;Thriller, Fiction, Horror, Thriller, Mystery Thriller, Suspense, Mystery, Crime, Adventure, Audiobook, Mystery, Detective;http://images.amazon.com/images/P/0446611239.01.LZZZZZZZ.jpg;;7.052631578947368;8.15;;8.0;7.5
044661162X;Chasing the Dime;Michael Connelly;2003-01-01;Warner Books;Mystery;Fiction, Mystery, Crime, Thriller, Suspense, Thriller, Mystery Thriller, Mystery, Detective, Audiobook, Emergency Services, Police, Womens;http://images.amazon.com/images/P/044661162X.01.LZZZZZZZ.jpg;7.0;7.6923076923076925;8.0;;;8.125
0446611778;Last Man Standing;David Baldacci;2002-01-01;Warner Vision;Fiction;Thriller, Mystery, Suspense, Mystery, Crime, Thriller, Mystery Thriller, Audiobook, Action, Adventure, Novels;http://images.amazon.com/images/P/0446611778.01.LZZZZZZZ.jpg;;7.9375;7.92;3.0;;6.15
0446611913;Up Country;Nelson DeMille;2003-01-01;Warner Vision;Fiction;Thriller, Mystery, Thriller, Mystery Thriller, Suspense, Historical, Historical Fiction, War, Military Fiction, Adventure, War, Mystery, Crime;http://images.amazon.com/images/P/0446611913.01.LZZZZZZZ.jpg;;9.0;8.818181818181818;7.0;;9.0
044661193X;Basket Case;Carl Hiaasen;2003-01-01;Warner Books;Fiction;Mystery, Humor, Mystery, Crime, Humor, Comedy, Thriller, Mystery Thriller, Audiobook, Thriller, Novels, Contemporary;http://images.amazon.com/images/P/044661193X.01.LZZZZZZZ.jpg;;7.0;8.052631578947368;;8.0;6.666666666666667
0446612545;The Beach House;James Patterson;2003-01-01;Warner Books;Mystery;Fiction, Thriller, Mystery, Crime, Suspense, Thriller, Mystery Thriller, Mystery, Murder Mystery, Adult, Audiobook, Adult Fiction;http://images.amazon.com/images/P/0446612545.01.LZZZZZZZ.jpg;10.0;7.086956521739131;8.01923076923077;;8.05;7.78125
0446612618;A Kiss Remembered;Sandra Brown;2003-01-01;Warner Books;Romance;Romance, Contemporary Romance, Contemporary, Fiction, Audiobook, Womens Fiction, Chick Lit, Category Romance, Harlequin, Adult, Romance, Romantic Suspense, Roman;http://images.amazon.com/images/P/0446612618.01.LZZZZZZZ.jpg;;5.0;5.0;;9.0;8.0
0446612626;Reversible Errors;Scott Turow;2003-01-01;Warner Vision;Fiction;Mystery, Thriller, Legal Thriller, Thriller, Mystery, Crime, Thriller, Mystery Thriller, Suspense, Audiobook, Adult Fiction, Law;http://images.amazon.com/images/P/0446612626.01.LZZZZZZZ.jpg;;;6.75;;;5.0
0446612731;The Black Echo;Michael Connelly;2002-01-01;Warner Books;Mystery;Fiction, Mystery, Crime, Thriller, Thriller, Mystery Thriller, Mystery, Detective, Audiobook, Suspense, Mystery, Murder Mystery, Novels;http://images.amazon.com/images/P/0446612731.01.LZZZZZZZ.jpg;;8.0;8.25;;;9.0
0446612766;Still Life with Crows;Douglas Preston;2004-01-01;Warner Books;Thriller;Mystery, Fiction, Horror, Thriller, Mystery Thriller, Suspense, Mystery, Crime, Audiobook, Mystery, Detective, Adventure;http://images.amazon.com/images/P/0446612766.01.LZZZZZZZ.jpg;;8.5;9.5;;;10.0
0446613444;The Black Ice;Michael Connelly;2003-01-01;Warner Vision;Mystery;Fiction, Mystery, Crime, Thriller, Thriller, Mystery Thriller, Mystery, Detective, Audiobook, Suspense, Mystery, Murder Mystery, Emergency Services, Police;http://images.amazon.com/images/P/0446613444.01.LZZZZZZZ.jpg;;;7.333333333333333;;;8.0
0446671827;Emergence : Labeled Autistic;Temple Grandin;1996-01-01;Warner Books;Neurodiversity;Autistic Spectrum Disorder, Nonfiction, Autobiography, Memoir, Psychology, Biography, Biography, Autobiography, Biography Memoir, Science, Disability, Mental Health, Mental Illness;http://images.amazon.com/images/P/0446671827.01.LZZZZZZZ.jpg;;10.0;;;;
0446672211;Where the Heart Is (Oprah's Book Club (Paperback));Billie Letts;1998-01-01;Warner Books;Fiction;Womens Fiction, Chick Lit, Romance, Contemporary, Adult Fiction, Adult, Drama, Realistic Fiction, Young Adult, Novels;http://images.amazon.com/images/P/0446672211.01.LZZZZZZZ.jpg;9.0;8.154471544715447;8.059322033898304;8.0;8.133333333333333;8.116279069767442
0446673781;One L : The Turbulent True Story of a First Year at Harvard Law School;Scott Turow;1997-01-01;Warner Books;Law;Nonfiction, Autobiography, Memoir, Biography, Education, Biography Memoir, Academic, College, Biography, Autobiography, Academic, Academia, Business;http://images.amazon.com/images/P/0446673781.01.LZZZZZZZ.jpg;;8.0;;;6.0;
0446674575;The Tenth Insight : Holding the Vision (Celestine Prophecy);James Redfield;1998-01-01;Warner Books;Fiction;Spirituality, Philosophy, Self Help, Spirituality, New Age, Fantasy, Adventure, Religion, Inspirational, Novels;http://images.amazon.com/images/P/0446674575.01.LZZZZZZZ.jpg;;5.0;;;5.0;9.0
0446674826;Word of Honor;Nelson DeMille;1998-01-01;Warner Books;Fiction;Thriller, Mystery, Suspense, Thriller, Mystery Thriller, War, Historical, Historical Fiction, War, Military Fiction, Audiobook, Historical;http://images.amazon.com/images/P/0446674826.01.LZZZZZZZ.jpg;;;8.0;;;8.0
0446675237;The Celestine Vision : Living the New Spiritual Awareness;James Redfield;1999-01-01;Warner Books;Spirituality;Nonfiction, Philosophy, Self Help, Spirituality, New Age, Religion, Adventure, Inspirational, Mystery, Philosophy, Metaphysics;http://images.amazon.com/images/P/0446675237.01.LZZZZZZZ.jpg;;;10.0;;;
0446675369;Bless Me, Ultima;Rudolfo Anaya;1999-01-01;Warner Books;Fiction;Classics, Magical Realism, Young Adult, Academic, School, Historical, Historical Fiction, Literature, Banned Books, Literature, Young Adult, Coming Of Age, Fantasy;http://images.amazon.com/images/P/0446675369.01.LZZZZZZZ.jpg;;10.0;8.0;;;
0446675539;Gone with the Wind;Margaret Mitchell;1999-01-01;Warner Books;Classics;Historical, Historical Fiction, Fiction, Romance, Historical, War, Literature, Military History, Civil War, Romance, Historical Romance, Novels;http://images.amazon.com/images/P/0446675539.01.LZZZZZZZ.jpg;;10.0;;;;
0446676071;Message in a Bottle;Nicholas Sparks;1999-01-01;Warner Books;Romance;Fiction, Womens Fiction, Chick Lit, Contemporary, Adult, Adult Fiction, Romance, Contemporary Romance, Drama, Love, Novels;http://images.amazon.com/images/P/0446676071.01.LZZZZZZZ.jpg;;;7.5;;7.666666666666667;8.0
0446676438;When the Wind Blows;James Patterson;2000-01-01;Warner Books;Mystery;Fiction, Thriller, Fantasy, Science Fiction, Suspense, Thriller, Mystery Thriller, Mystery, Crime, Adult, Adventure;http://images.amazon.com/images/P/0446676438.01.LZZZZZZZ.jpg;;;8.5;;;9.0
0446676489;The Secret of Shambhala : In Search of the Eleventh Insight;James Redfield;2001-01-01;Warner Books;Fiction;Spirituality, Philosophy, Self Help, Adventure, Spirituality, New Age, Fantasy, Religion, Novels, Inspirational;http://images.amazon.com/images/P/0446676489.01.LZZZZZZZ.jpg;;10.0;;;9.0;
0446677124;The Burden of Proof;Scott Turow;2000-01-01;Warner Books;Fiction;Mystery, Thriller, Thriller, Legal Thriller, Mystery, Crime, Thriller, Mystery Thriller, Suspense, Law, Novels, Adult Fiction;http://images.amazon.com/images/P/0446677124.01.LZZZZZZZ.jpg;;;8.0;;;
0446677167;Stormy Weather;Carl Hiaasen;2001-01-01;Warner Books;Fiction;Humor, Mystery, Mystery, Crime, Thriller, Humor, Comedy, Thriller, Mystery Thriller, Audiobook, Contemporary, Adult;http://images.amazon.com/images/P/0446677167.01.LZZZZZZZ.jpg;;;7.5;;;7.5
0446678457;Cane River (Oprah's Book Club (Paperback));Lalita Tademy;2002-01-01;Warner Books;Historical;Historical Fiction, Fiction, Historical, Cultural, African American, American, Southern, Book Club, Adult, Family, Race, Novels;http://images.amazon.com/images/P/0446678457.01.LZZZZZZZ.jpg;;9.0;7.666666666666667;;10.0;8.11111111111111
0446691402;Gloriana : Or the Unfulfill'd Queen;Michael Moorcock;2004-01-01;Aspect;Fantasy;Fiction, Historical, Historical Fiction, Science Fiction, Science Fiction, Alternate History, Historical, Science Fiction Fantasy, Literature, 20th Century, Novels, Speculative Fiction;http://images.amazon.com/images/P/0446691402.01.LZZZZZZZ.jpg;;;;;;10.0
0446691798;Nights in Rodanthe;Nicholas Sparks;2003-01-01;Warner Books;Romance;Fiction, Womens Fiction, Chick Lit, Contemporary, Adult, Adult Fiction, Romance, Contemporary Romance, Love, Drama, Novels;http://images.amazon.com/images/P/0446691798.01.LZZZZZZZ.jpg;;8.0;8.5;;;
0446692638;Along Came a Spider (Alex Cross Novels);James Patterson;2003-01-01;Warner Books;Mystery;Fiction, Thriller, Mystery, Crime, Thriller, Mystery Thriller, Suspense, Mystery, Detective, Adult, Audiobook, Mystery, Murder Mystery;http://images.amazon.com/images/P/0446692638.01.LZZZZZZZ.jpg;;8.5;;;;
0446912069;The Celestine Prophecy : A Pocket Guide to the Nine Insights;James Redfield;1996-01-01;Warner Books;Spirituality;Fiction, Self Help, Philosophy, Religion;http://images.amazon.com/images/P/0446912069.01.LZZZZZZZ.jpg;6.0;;;;;
0448400634;Anne of Avonlea: An Anne of Green Gables Story (Illustrated Junior Library Edition);L. M. Montgomery;1990-01-01;Grosset & Dunlap;Classics;Fiction, Young Adult, Historical, Historical Fiction, Childrens, Historical, Romance, Audiobook, Cultural, Canada, Childrens, Middle Grade;http://images.amazon.com/images/P/0448400634.01.LZZZZZZZ.jpg;;;;;10.0;
0448433400;Storybook Treasury of Dick and Jane Friends (Dick and Jane (Hardcover));William S. Gray;2003-01-01;Grosset & Dunlap;Childrens;Childrens, Picture Books, Fiction, Kids, Classics;http://images.amazon.com/images/P/0448433400.01.LZZZZZZZ.jpg;;10.0;;;;10.0
0449001156;The Gift of Asher Lev;Chaim Potok;1991-01-01;Ballantine Books;Fiction;Literature, Jewish, Religion, Religion, Judaism, Classics, Historical, Historical Fiction, Art, Literature, Young Adult, Novels;http://images.amazon.com/images/P/0449001156.01.LZZZZZZZ.jpg;;;7.0;;9.0;
0449001172;Wartime Lies : A Novel;LOUIS BEGLEY;1997-01-01;Ballantine Books;Fiction;Historical, Historical Fiction, World War II, Holocaust, War, War, World War II, Novels, Cultural, Poland, Historical, Literary Fiction, Literature, Jewish;http://images.amazon.com/images/P/0449001172.01.LZZZZZZZ.jpg;;;;;;8.0
0449001245;Naked Came the Manatee;Carl Hiaasen;1998-01-01;Ballantine Books;Fiction;Mystery, Humor, Humor, Comedy, Mystery, Crime, Short Stories, Thriller, Thriller, Mystery Thriller, Anthologies, Novels;http://images.amazon.com/images/P/0449001245.01.LZZZZZZZ.jpg;;9.0;;;;8.0
0449001962;Murder in Foggy Bottom (Truman, Margaret, Capital Crimes Series.);Margaret Truman;2002-01-01;Fawcett Books;Mystery;Fiction, Thriller, Mystery Thriller, Suspense, Mystery, Murder Mystery, Audiobook, Mystery, Crime, Adult Fiction;http://images.amazon.com/images/P/0449001962.01.LZZZZZZZ.jpg;;7.0;;;;9.0
0449002411;The Presence;John Saul;1998-01-01;Ballantine Books;Horror;Fiction, Thriller, Mystery, Suspense, Science Fiction, Thriller, Mystery Thriller, Adult, Fantasy, Paranormal, Fantasy;http://images.amazon.com/images/P/0449002411.01.LZZZZZZZ.jpg;;8.058823529411764;7.0;;7.0;7.0
0449002985;Your Oasis on Flame Lake (Ballantine Reader's Circle);LORNA LANDVIK;1998-01-01;Ballantine Books;Fiction;Womens Fiction, Chick Lit, Humor, Contemporary, Womens Fiction, Book Club, Novels, Drama, Literature, 20th Century, Adult Fiction;http://images.amazon.com/images/P/0449002985.01.LZZZZZZZ.jpg;;10.0;7.923076923076923;;5.0;9.0
0449003884;The Bride Finder : A Novel;SUSAN CARROLL;1999-01-01;Ivy Books;Romance;Romance, Historical Romance, Fantasy, Paranormal, Historical, Fantasy, Romance, Paranormal Romance, Historical, Historical Fiction, Fiction, Fantasy, Magic, Gothic;http://images.amazon.com/images/P/0449003884.01.LZZZZZZZ.jpg;;5.0;10.0;;;
044900483X;Children of God (Ballantine Readers Circle);Mary Doria Russell;1999-01-01;Ballantine Books;Science Fiction;Fiction, Religion, Fantasy, Science Fiction Fantasy, Speculative Fiction, Science Fiction, Aliens, Novels, Literary Fiction, Adult;http://images.amazon.com/images/P/044900483X.01.LZZZZZZZ.jpg;;7.333333333333333;8.0;;;9.0
0449005577;Catching Alice;Clare Naylor;2000-01-01;Ballantine Books;Womens Fiction;Chick Lit, Fiction, Romance;http://images.amazon.com/images/P/0449005577.01.LZZZZZZZ.jpg;;8.0;6.0;;;
0449006530;Midnight Voices;JOHN SAUL;2003-01-01;Ballantine Books;Horror;Fiction, Thriller, Mystery, Suspense, Fantasy, Supernatural, Fantasy, Paranormal, Fantasy, Audiobook, Thriller, Mystery Thriller;http://images.amazon.com/images/P/0449006530.01.LZZZZZZZ.jpg;;8.153846153846153;7.217391304347826;;7.5;7.75
0449007383;Murder at Ford's Theatre;MARGARET TRUMAN;2003-01-01;Fawcett;Mystery;Fiction, Mystery, Murder Mystery, Thriller, Mystery Thriller, Female Authors, Suspense, Mystery, Crime;http://images.amazon.com/images/P/0449007383.01.LZZZZZZZ.jpg;;;10.0;;;
0449146979;The Changeling;Philippa Carr;1990-01-01;Ivy Books;Historical;Historical Fiction, Romance, Fiction, Romance, Historical Romance, Historical, European Literature, British Literature, Gothic, Mystery, Literature, 19th Century, Adult;http://images.amazon.com/images/P/0449146979.01.LZZZZZZZ.jpg;;;5.0;;;
044920149X;The Capricorn Stone;Madeleine Brent;1983-01-01;Fawcett Books;Romance;Fiction, Mystery, Historical, Historical Fiction, Historical, Gothic, Gothic Romance, Romance, Romantic Suspense, Adventure, Romance, Historical Romance, Suspense;http://images.amazon.com/images/P/044920149X.01.LZZZZZZZ.jpg;;;;;8.0;
0449207331;Iberia;James A. Michener;1989-01-01;Fawcett Books;Historical;Historical Fiction, Travel, Fiction, Cultural, Spain, History, European History, Historical, Audiobook, Literature, Novels, Cultural;http://images.amazon.com/images/P/0449207331.01.LZZZZZZZ.jpg;;;;;7.0;5.0
0449212963;Secret for a Nightingale;Victoria Holt;1991-01-01;Ivy Books;Romance;Historical, Historical Fiction, Fiction, Mystery, Gothic, Romance, Historical Romance, Historical, Romance, Romantic Suspense, Gothic, Gothic Romance, Historical, Victorian;http://images.amazon.com/images/P/0449212963.01.LZZZZZZZ.jpg;;4.0;;;8.0;
0449213536;The Drifters;James A. Michener;1986-01-01;Fawcett Books;Fiction;Historical, Historical Fiction, Travel, Adventure, Novels, Classics, Historical, Cultural, Spain, Literature, Contemporary;http://images.amazon.com/images/P/0449213536.01.LZZZZZZZ.jpg;;10.0;;;7.0;
0449213897;Golden Urchin;Madeleine Brent;1988-01-01;Fawcett Books;Romance;Historical, Historical Fiction, Fiction, Historical, Mystery, Adventure, Cultural, Australia, Romance, Historical Romance, Gothic, Gothic, Gothic Romance;http://images.amazon.com/images/P/0449213897.01.LZZZZZZZ.jpg;;;;;9.0;
0449214540;The Rabbi;Noah Gordon;1991-01-01;Fawcett Books;Fiction;Historical, Historical Fiction, Historical, Literature, Jewish, Religion, The United States Of America, Religion, Judaism, Novels, Romance, Drama;http://images.amazon.com/images/P/0449214540.01.LZZZZZZZ.jpg;;;7.5;;;
0449215482;The Silk Vendetta;Victoria Holt;1988-01-01;Ivy Books;Romance;Gothic, Mystery, Historical, Historical Fiction, Romance, Historical Romance, Fiction, Historical, Gothic, Gothic Romance, Romance, Romantic Suspense, European Literature, British Literature;http://images.amazon.com/images/P/0449215482.01.LZZZZZZZ.jpg;;8.0;9.5;;;
0449218473;Journey;James A. Michener;1994-01-01;Fawcett Books;Historical;Historical Fiction, Fiction, Cultural, Canada, Adventure, Literature, 19th Century, Historical, Travel, Adventure, Survival, Audiobook, Classics;http://images.amazon.com/images/P/0449218473.01.LZZZZZZZ.jpg;;7.0;9.0;;9.0;
0449220494;Dick Francis Treasury of Great Racing Stories;Dick Francis;1992-01-01;Fawcett Books;Short Stories;Animals, Horses;http://images.amazon.com/images/P/0449220494.01.LZZZZZZZ.jpg;;;;;;8.0
0449221393;Driving Force;Dick Francis;1994-01-01;Fawcett Books;Mystery;Fiction, Thriller, Mystery, Crime, Suspense, Thriller, Mystery Thriller, Mystery, Detective, European Literature, British Literature, Animals, Horses, Contemporary;http://images.amazon.com/images/P/0449221393.01.LZZZZZZZ.jpg;;6.0;7.0;;;9.0
0449227944;Asylum (Blackstone Chronicles, No 6);JOHN SAUL;1997-01-01;Fawcett;Horror;Fiction, Short Stories, Thriller, Thriller, Mystery Thriller, Mystery;http://images.amazon.com/images/P/0449227944.01.LZZZZZZZ.jpg;;7.0;9.0;;8.0;
0449300021;Les Miserables;VICTOR HUGO;1982-01-01;Fawcett;Classics;Fiction, Historical, Historical Fiction, Literature, Cultural, France, Historical, Novels, European Literature, French Literature, Romance, Classics, Classic Literature;http://images.amazon.com/images/P/0449300021.01.LZZZZZZZ.jpg;9.0;8.0;10.0;;10.0;
0449904962;Indian Givers: How the Indians of the Americas Transformed the World;Jack Weatherford;1990-01-01;Ballantine Books;History;Nonfiction, Anthropology, North American Hi..., American History, Native Americans, History, Native American History, Historical, Audiobook, Race, Literature, American;http://images.amazon.com/images/P/0449904962.01.LZZZZZZZ.jpg;;;9.0;;;10.0
0449908976;Anatomy of Love: A Natural History of Mating, Marriage, and Why We Stray;Helen Fisher;1995-01-01;Ballantine Books;Nonfiction;Psychology, Science, Relationships, History, Sexuality, Anthropology, Love, Sociology, Biology, Evolution;http://images.amazon.com/images/P/0449908976.01.LZZZZZZZ.jpg;;6.0;;;;
0449910830;The All-True Travels and Adventures of Lidie Newton: A Novel (Ballantine Reader's Circle);Jane Smiley;1999-01-01;Ballantine Books;Historical;Historical Fiction, Fiction, Westerns, Novels, Historical, Travel, Adventure, Literary Fiction, Literature, American, Literature;http://images.amazon.com/images/P/0449910830.01.LZZZZZZZ.jpg;;8.666666666666666;6.5;;;
0449911411;And I Don't Want to Live This Life;Deborah Spungen;1996-01-01;Ballantine Books;Nonfiction;Biography, Crime, True Crime, Music, Autobiography, Memoir, Mystery, Crime, Biography Memoir, Mental Health, Mental Illness, Music, Punk, Psychology;http://images.amazon.com/images/P/0449911411.01.LZZZZZZZ.jpg;;9.0;;;;
0449911632;Brazil;John Updike;1996-01-01;Ballantine Books;Fiction;Cultural, Brazil, Literature, American, Novels, Magical Realism, Classics, Historical, Historical Fiction, Literary Fiction, Contemporary, Literature;http://images.amazon.com/images/P/0449911632.01.LZZZZZZZ.jpg;;8.0;;;;
0449911721;Morgan's Passing;Anne Tyler;1996-01-01;Ballantine Books;Fiction;Literary Fiction, Contemporary, Literature, American, Novels, Literature, Adult Fiction, Relationships, Womens Fiction, Family;http://images.amazon.com/images/P/0449911721.01.LZZZZZZZ.jpg;;;7.5;;;
0449911802;Celestial Navigation;Anne Tyler;1996-01-01;Ballantine Books;Fiction;Literary Fiction, Novels, Contemporary, Literature, Adult, The United States Of America, Literature, American, Literature, 20th Century, Adult Fiction;http://images.amazon.com/images/P/0449911802.01.LZZZZZZZ.jpg;;;;;;9.0
0451143426;One Flew Over the Cuckoo's Nest;Ken Kesey;1963-01-01;Signet Book;Classics;Fiction, Psychology, Literature, Novels, Health, Mental Health, Academic, School, Literature, American, Literary Fiction, Mental Health, Mental Illness;http://images.amazon.com/images/P/0451143426.01.LZZZZZZZ.jpg;;5.5;;;;
0451147952;Capitalism: The Unknown Ideal (Signet Shakespeare);Ayn Rand;1983-01-01;Signet Book;Philosophy;Economics, Nonfiction, Politics, Business, Classics, History, Writing, Essays, Economics, Finance, Science;http://images.amazon.com/images/P/0451147952.01.LZZZZZZZ.jpg;;;5.0;;10.0;
0451159411;They Cage the Animals at Night;Jennings M. Burch;1988-01-01;Signet Book;Nonfiction;Autobiography, Memoir, Biography, Academic, School, Psychology, Biography, Autobiography, Biography Memoir, Sociology, Abuse, Family Law, Fostering, Academic, Read For School;http://images.amazon.com/images/P/0451159411.01.LZZZZZZZ.jpg;;5.5;8.5;;;8.0
0451160193;Fools Die;Mario Puzo;1994-01-01;Signet Book;Fiction;Thriller, Mystery, Crime, Novels, Mystery, Classics, Drama, Suspense, Contemporary, Literature;http://images.amazon.com/images/P/0451160193.01.LZZZZZZZ.jpg;;7.0;;;10.0;
0451160312;I Never Promised You a Rose Garden;Joanne Greenberg;1984-01-01;Signet Book;Fiction;Psychology, Young Adult, Health, Mental Health, Classics, Mental Health, Mental Illness, Contemporary, Novels, Realistic Fiction, Literature;http://images.amazon.com/images/P/0451160312.01.LZZZZZZZ.jpg;;7.875;9.0;;8.1;9.0
0451160525;The Gunslinger (The Dark Tower, Book 1);Stephen King;1994-01-01;New American Library;Fantasy;Fiction, Horror, Science Fiction, Westerns, Adventure, Audiobook, Science Fiction Fantasy, Thriller, Apocalyptic, Post Apocalyptic;http://images.amazon.com/images/P/0451160525.01.LZZZZZZZ.jpg;;8.09433962264151;8.916666666666666;;8.185185185185185;8.0
0451163931;Virtue of Selfishness: A New Concept of Egoism;Ayn Rand;1989-01-01;Signet Book;Philosophy;Nonfiction, Politics, Psychology, Classics, Writing, Essays, Economics, History, Modern, Contemporary;http://images.amazon.com/images/P/0451163931.01.LZZZZZZZ.jpg;;10.0;;;10.0;
0451166582;The Eyes of the Dragon;Stephen King;2001-01-01;Signet Book;Fantasy;Fiction, Horror, Young Adult, Fantasy, Dragons, Science Fiction Fantasy, Adventure, Thriller, Audiobook, Novels;http://images.amazon.com/images/P/0451166582.01.LZZZZZZZ.jpg;;8.153846153846153;8.1875;;8.214285714285714;10.0
0451170113;Night Shift;Stephen King;1994-01-01;Signet Book;Horror;Short Stories, Fiction, Thriller, Fantasy, Mystery, Anthologies, Fantasy, Paranormal, Suspense, Fantasy, Supernatural;http://images.amazon.com/images/P/0451170113.01.LZZZZZZZ.jpg;;8.15;9.333333333333334;;8.333333333333334;
0451171926;Atlas Shrugged;Ayn Rand;1992-01-01;New Amer Library;Fiction;Classics, Philosophy, Politics, Literature, Science Fiction, Novels, Science Fiction, Dystopia, Economics, Business;http://images.amazon.com/images/P/0451171926.01.LZZZZZZZ.jpg;;9.0;8.0;;10.0;
0451173317;The Waste Lands (The Dark Tower, Book 3);Stephen King;1997-01-01;Signet Book;Fantasy;Fiction, Horror, Science Fiction, Adventure, Westerns, Audiobook, Science Fiction Fantasy, Thriller, Apocalyptic, Post Apocalyptic;http://images.amazon.com/images/P/0451173317.01.LZZZZZZZ.jpg;;8.8;9.0;;9.0;
0451180410;Mortal Fear;Greg Iles;1998-01-01;Signet Book;Mystery;Thriller, Fiction, Suspense, Mystery, Crime, Thriller, Mystery Thriller, Horror, Audiobook, Novels, Mystery, Murder Mystery;http://images.amazon.com/images/P/0451180410.01.LZZZZZZZ.jpg;;6.75;7.2;;;8.0
0451185978;Four Past Midnight (Novella from Four Past Midnight);Stephen King;1995-01-01;New Amer Library;Horror;Fiction, Short Stories, Thriller, Fantasy, Mystery, Suspense, Fantasy, Supernatural, Anthologies, Science Fiction;http://images.amazon.com/images/P/0451185978.01.LZZZZZZZ.jpg;;;8.0;;;8.0
0451187261;Matters of Choice;Noah Gordon;1997-01-01;Signet Book;Historical;Historical Fiction, Fiction, Historical, Drama, Novels, Contemporary, The United States Of America, Health, Medicine, Medical, European Literature, German Literature;http://images.amazon.com/images/P/0451187261.01.LZZZZZZZ.jpg;;;;;;8.0
0451187849;We the Living;Ayn Rand;1996-01-01;Signet Book;Fiction;Classics, Philosophy, Historical, Historical Fiction, Literature, Politics, Cultural, Russia, Novels, Science Fiction, Dystopia, Historical;http://images.amazon.com/images/P/0451187849.01.LZZZZZZZ.jpg;;8.666666666666666;;;10.0;
0451188454;The Bone Collector (Lincoln Rhyme Novels (Paperback));Jeff Deaver;2004-01-01;Signet Book;Mystery;Thriller, Fiction, Mystery, Crime, Thriller, Mystery Thriller, Suspense, Mystery, Detective, Horror, Adult, Mystery, Murder Mystery;http://images.amazon.com/images/P/0451188454.01.LZZZZZZZ.jpg;;8.088235294117647;8.923076923076923;7.0;8.0;7.0
0451190149;The Inner Sanctum;Stephen W. Frey;1998-01-01;Signet Book;Fiction;Thriller, Suspense, Politics, Mystery, Crime;http://images.amazon.com/images/P/0451190149.01.LZZZZZZZ.jpg;;;6.5;;;8.0
0451190750;Thinner;Stephen King;1996-01-01;Signet Book;Horror;Fiction, Thriller, Fantasy, Fantasy, Supernatural, Fantasy, Paranormal, Mystery, Suspense, Audiobook, Novels;http://images.amazon.com/images/P/0451190750.01.LZZZZZZZ.jpg;;8.666666666666666;9.0;;6.0;
0451191153;The Fountainhead;Ayn Rand;1996-01-01;New American Library;Fiction;Classics, Philosophy, Literature, Novels, Politics, Architecture, Literary Fiction, Literature, American, Classics, Classic Literature;http://images.amazon.com/images/P/0451191153.01.LZZZZZZZ.jpg;;9.125;8.0;;8.928571428571429;
0451192524;Ritual Sins;Anne Stuart;1997-01-01;Onyx Books;Romance;Romance, Romantic Suspense, Contemporary, Romance, Contemporary Romance, Suspense, Dark, Fiction, Thriller, Mystery, Thriller, Mystery Thriller;http://images.amazon.com/images/P/0451192524.01.LZZZZZZZ.jpg;;;;;9.0;
0451196716;The Long Walk;Stephen King;1999-01-01;Signet Book;Horror;Fiction, Science Fiction, Dystopia, Thriller, Science Fiction, Fantasy, Audiobook, Adult, Suspense, Novels;http://images.amazon.com/images/P/0451196716.01.LZZZZZZZ.jpg;;6.5;7.5;;9.0;7.0
