ISBN;Book-Title;Book-Author;Year-Of-Publication;Publisher;Genre Principal;Genres Secondaires;Image-URL-L;Moyenne_Adolescent 12-17;Moyenne_Adulte 26-35;Moyenne_Adulte 36-50;Moyenne_Enfant 1-12;Moyenne_Jeune adulte 18-25;Moyenne_Senior 50+
000617695X;The Great & Secret Show;Barker Clive;1990-01-01;HarperCollins Publishers;Horror;Fantasy, Fiction, Fantasy, Dark Fantasy, Thriller, Science Fiction, Novels, Fantasy, Urban Fantasy, Suspense, Fantasy, Supernatural;http://images.amazon.com/images/P/000617695X.01.LZZZZZZZ.jpg;;6.0;;;;
0007144350;Collins Complete Works of Oscar Wilde (Collins Classics S.);Oscar Wilde;2003-01-01;HarperCollins Publishers;Classics;Fiction, Poetry, Plays, Short Stories, Literature, Drama, Humor, Writing, Essays, Literature, 19th Century;http://images.amazon.com/images/P/0007144350.01.LZZZZZZZ.jpg;;;10.0;;;
0020199856;LOVE OF THE LAST TYCOON;F. Scott Fitzgerald;1995-01-01;Scribner;Classics;Fiction, Literature, Literature, American, Novels, Literature, 20th Century, Historical, Historical Fiction, Literary Fiction, Romance, Classics, Modern Classics;http://images.amazon.com/images/P/0020199856.01.LZZZZZZZ.jpg;;8.0;;;;
0020360754;Heart Songs and Other Stories;Annie Proulx;1995-01-01;Scribner;Short Stories;Fiction, Literary Fiction, Literature, American, Literature, The United States Of America, Contemporary, Literature, 20th Century, Cultural, Canada, Womens;http://images.amazon.com/images/P/0020360754.01.LZZZZZZZ.jpg;;8.5;5.0;;;
0020421907;Seaward;Susan Cooper;1987-01-01;Simon Pulse;Fantasy;Young Adult, Fiction, Childrens, Adventure, Childrens, Middle Grade, Young Adult, Young Adult Fantasy, Science Fiction Fantasy, Romance, Fantasy, Magic;http://images.amazon.com/images/P/0020421907.01.LZZZZZZZ.jpg;;8.0;;;9.5;
0020442602;Voyage of the Dawn Treader;C. S. Lewis;1970-01-01;MacMillan Publishing Company.;Fantasy;Fiction, Classics, Young Adult, Childrens, Adventure, Christian, Childrens, Middle Grade, Christian Fiction, Science Fiction Fantasy;http://images.amazon.com/images/P/0020442602.01.LZZZZZZZ.jpg;;8.0;9.0;;9.0;
0020518609;Short Stories of Ernest Hemingway (A Scribner classic);Ernest Hemingway;1987-01-01;Simon & Schuster;Fiction;Short Stories, Classics, Literature, Literature, American, The United States Of America, Literary Fiction, Literature, 20th Century, American, Americana, Novels;http://images.amazon.com/images/P/0020518609.01.LZZZZZZZ.jpg;;8.666666666666666;7.5;;;7.0
0023895306;Nicomachean Ethics : Aristotle;Martin Ostwald;1962-01-01;Prentice Hall;Philosophy;Classics, Nonfiction, Politics, Academic, School, Literature, Ancient, History, Cultural, Greece, Academic, College, History, Ancient History;http://images.amazon.com/images/P/0023895306.01.LZZZZZZZ.jpg;;5.0;;;;
0024181900;The Elements of Style, Third Edition;William Strunk Jr.;1979-01-01;Pearson P T R;Language;Writing, Nonfiction, Reference, Humanities, Language, Classics, Education, Self Help, Business, Academic, School, Textbooks;http://images.amazon.com/images/P/0024181900.01.LZZZZZZZ.jpg;;;10.0;;;
0060001445;Her Highness, My Wife;Victoria Alexander;2002-01-01;Avon;Romance;Historical Romance, Romance, Historical, Historical, Regency, Historical, Historical Fiction, Fiction, Historical Romance, Regency Romance, Adult, European Literature, British Literature, Romance, M F Romance;http://images.amazon.com/images/P/0060001445.01.LZZZZZZZ.jpg;;6.0;;;;8.0
0060001453;Love With the Proper Husband (Avon Historical Romance);Victoria Alexander;2003-01-01;Avon;Romance;Historical Romance, Romance, Historical, Historical, Regency, Historical, Historical Fiction, Fiction, Historical Romance, Regency Romance, European Literature, British Literature, Adult, Womens Fiction, Chick Lit;http://images.amazon.com/images/P/0060001453.01.LZZZZZZZ.jpg;;6.666666666666667;6.666666666666667;;10.0;9.0
006000181X;With Her Last Breath;Cait London;2003-01-01;Avon;Romance;Romantic Suspense, Romance, Suspense;http://images.amazon.com/images/P/006000181X.01.LZZZZZZZ.jpg;;5.0;;;;8.0
0060002050;On a Wicked Dawn (Cynster Novels);Stephanie Laurens;2002-01-01;Avon Books;Romance;Romance, Historical Romance, Historical, Historical, Regency, Historical, Historical Fiction, Historical Romance, Regency Romance, Fiction, Adult, European Literature, British Literature, Audiobook;http://images.amazon.com/images/P/0060002050.01.LZZZZZZZ.jpg;;7.0;8.0;;6.5;8.0
0060002069;The Lady Chosen;Stephanie Laurens;2003-01-01;Avon Books;Romance;Historical Romance, Romance, Historical, Historical, Regency, Historical, Historical Fiction, Historical Romance, Regency Romance, Fiction, Mystery, Audiobook, Adult;http://images.amazon.com/images/P/0060002069.01.LZZZZZZZ.jpg;;7.5;6.5;;;7.0
006000942X;How to Read Literature Like a Professor : A Lively and Entertaining Guide to Reading Between the Lines;Thomas C. Foster;2003-01-01;Perennial Currents;Nonfiction;Academic, School, Writing, Books About Books, Language, Writing, Education, Literature, Academic, Read For School, Reference, Criticism, Literary Criticism, Young Adult, High School;http://images.amazon.com/images/P/006000942X.01.LZZZZZZZ.jpg;;7.0;9.0;;;6.0
0060011572;Animal Liberation;Peter Singer;2001-01-01;Ecco;Philosophy;Nonfiction, Animals, Food and Drink, Vegan, Politics, Food and Drink, Food, Science, Environment, Social Issues, Activism, Environment, Nature;http://images.amazon.com/images/P/0060011572.01.LZZZZZZZ.jpg;;9.0;;;;
0060013133;Going Postal : A Novel of Discworld (Pratchett, Terry);Terry Pratchett;2004-01-01;HarperCollins;Fantasy;Fiction, Humor, Humor, Comedy, Science Fiction Fantasy, Audiobook, Science Fiction, Adult, Novels, Young Adult;http://images.amazon.com/images/P/0060013133.01.LZZZZZZZ.jpg;;;;;;10.0
0060084537;Sharpe's Prey : Richard Sharpe and the Expedition to Denmark, 1807;Bernard Cornwell;2003-01-01;Perennial;Historical;Historical Fiction, Fiction, Historical, War, Adventure, War, Military Fiction, Audiobook, Action, Novels, European Literature, British Literature;http://images.amazon.com/images/P/0060084537.01.LZZZZZZZ.jpg;;;;;7.0;
0060085444;She Went All the Way (Avon Light Contemporary Romances);Meggin Cabot;2002-01-01;Avon;Womens Fiction;Chick Lit, Romance, Contemporary, Fiction, Romance, Contemporary Romance, Adult, Humor, Young Adult, Adult Fiction, Mystery;http://images.amazon.com/images/P/0060085444.01.LZZZZZZZ.jpg;;6.333333333333333;6.933333333333334;;9.0;8.5
0060085495;Island (Perennial Classics);Aldous Huxley;2002-01-01;Perennial;Fiction;Classics, Science Fiction, Philosophy, Science Fiction, Dystopia, Literature, Novels, Science Fiction, Utopia, Fantasy, European Literature, British Literature;http://images.amazon.com/images/P/0060085495.01.LZZZZZZZ.jpg;;9.0;9.0;;;8.0
0060086246;Last Chance Saloon;Marian Keyes;2003-01-01;Perennial;Womens Fiction;Chick Lit, Fiction, Romance, Contemporary, Humor, Cultural, Ireland, Romance, Contemporary Romance, Womens Fiction, European Literature, Irish Literature, Adult;http://images.amazon.com/images/P/0060086246.01.LZZZZZZZ.jpg;;8.071428571428571;9.0;;9.0;
0060086637;Barracuda 945;Patrick Robinson;2004-01-01;HarperTorch;Fiction;Thriller, War, Military Fiction, Action, Audiobook, Thriller, Mystery Thriller;http://images.amazon.com/images/P/0060086637.01.LZZZZZZZ.jpg;;;3.0;;;
0060090375;Lucy Sullivan Is Getting Married;Marian Keyes;2002-01-01;Perennial;Womens Fiction;Chick Lit, Fiction, Romance, Contemporary, Humor, Romance, Contemporary Romance, Cultural, Ireland, Adult, European Literature, Irish Literature, Womens Fiction;http://images.amazon.com/images/P/0060090375.01.LZZZZZZZ.jpg;;8.333333333333334;9.0;;5.0;
0060090383;Rachel's Holiday;Marian Keyes;2002-01-01;Perennial;Womens Fiction;Chick Lit, Fiction, Romance, Contemporary, Cultural, Ireland, Audiobook, European Literature, Irish Literature, Humor, Romance, Contemporary Romance, Adult;http://images.amazon.com/images/P/0060090383.01.LZZZZZZZ.jpg;;8.0;8.75;;9.0;
0060092572;The Terminal Man;Michael Crichton;2002-01-01;Avon Books;Fiction;Science Fiction, Thriller, Suspense, Horror, Mystery, Novels, Science Fiction Fantasy, Medical, Thriller, Mystery Thriller;http://images.amazon.com/images/P/0060092572.01.LZZZZZZZ.jpg;;7.0;7.0;;;
0060093749;The Art of the Novel (Perennial Classics);Milan Kundera;2003-01-01;Perennial Classics;Nonfiction;Language, Writing, Writing, Essays, Criticism, Literary Criticism, Literature, Criticism, European Literature, Czech Literature, Writing, Books About Books, Philosophy, Cultural, France;http://images.amazon.com/images/P/0060093749.01.LZZZZZZZ.jpg;;;;;7.0;
006009527X;Fire Lover: A True Story;Joseph Wambaugh;2002-01-01;William Morrow;Crime;True Crime, Nonfiction, Mystery, Crime, Mystery, History, Thriller, Biography, Emergency Services, Firefighters, Suspense, Audiobook;http://images.amazon.com/images/P/006009527X.01.LZZZZZZZ.jpg;;9.0;10.0;;;9.0
0060099453;Merry Christmas, Amelia Bedelia (I Can Read Book 2);Peggy Parish;2002-01-01;HarperTrophy;Holiday;Christmas, Childrens, Fiction, Childrens, Picture Books, Holiday, Humor, Kids, Classics, Young Adult, Childrens, Chapter Books;http://images.amazon.com/images/P/0060099453.01.LZZZZZZZ.jpg;;8.5;;;8.0;
0060166495;Back to Barbary Lane: The Final Tales of the City Omnibus;Armistead Maupin;1991-01-01;HarperCollins;Fiction;LGBT, LGBT, Gay, LGBT, Queer, Gay, Gay Fiction, Classics, Humor, Literature, American;http://images.amazon.com/images/P/0060166495.01.LZZZZZZZ.jpg;;;10.0;;;
0060175648;Identity;Milan Kundera;1998-01-01;Harpercollins;Fiction;Novels, European Literature, Czech Literature, Literature, Philosophy, Contemporary, Cultural, France, Classics, Literary Fiction, Literature, 20th Century;http://images.amazon.com/images/P/0060175648.01.LZZZZZZZ.jpg;;10.0;;;;
0060192305;There's a Spiritual Solution to Every Problem;Wayne W. Dyer;2001-01-01;HarperCollins;Spirituality;Self Help, Nonfiction, Philosophy, Psychology, Inspirational, Self Help, Personal Development, Audiobook, Religion, Spirituality, New Age;http://images.amazon.com/images/P/0060192305.01.LZZZZZZZ.jpg;;;8.0;;;
006019250X;The Illustrated Alchemist: A Fable About Following Your Dream;Paulo Coelho;1998-01-01;HarperCollins Publishers;Fiction;Classics, Fantasy, Philosophy, Novels, Spirituality, Self Help, Literature, Adventure, Inspirational;http://images.amazon.com/images/P/006019250X.01.LZZZZZZZ.jpg;;;;;;9.0
0060193395;Body for Life: 12 Weeks to Mental and Physical Strength;Bill Phillips;1999-01-01;HarperCollins;Health;Nonfiction, Sports, Fitness, Self Help, Sports, Sports, Reference, Food and Drink, Diets, Health, Nutrition, Food and Drink, Food, Self Help, Personal Development;http://images.amazon.com/images/P/0060193395.01.LZZZZZZZ.jpg;;9.0;7.0;;;7.0
006019491X;Daughter of Fortune : A Novel (Oprah's Book Club (Hardcover));Isabel Allende;1999-01-01;HarperCollins;Historical;Historical Fiction, Fiction, Historical, Romance, Magical Realism, Novels, Literature, Adult, Adult Fiction, European Literature, Spanish Literature;http://images.amazon.com/images/P/006019491X.01.LZZZZZZZ.jpg;;8.9;7.875;;8.0;7.916666666666667
006024416X;Betsy-Tacy and Tib;Maud Hart Lovelace;1994-01-01;HarperCollins;Childrens;Fiction, Classics, Historical, Historical Fiction, Childrens, Middle Grade, Childrens, Juvenile, Young Adult, Historical, Childrens, Childrens Classics, Literature, American;http://images.amazon.com/images/P/006024416X.01.LZZZZZZZ.jpg;;;10.0;;;
0060245603;Today I Feel Silly: And Other Moods That Make My Day;Jamie Lee Curtis;1998-01-01;Joanna Cotler;Childrens;Picture Books, Childrens, Psychology, Emotion, Fiction, Poetry, Family, Realistic Fiction, Humor, Childrens, Storytime, Contemporary;http://images.amazon.com/images/P/0060245603.01.LZZZZZZZ.jpg;;7.0;;;;
0060248122;The Mrs. Piggle-Wiggle Treasury;Betty Bard MacDonald;1995-01-01;Harpercollins Juvenile Books;Childrens;Fiction, Fantasy, Short Stories, Childrens, Juvenile, Childrens, Childrens Classics, Classics, Childrens, Middle Grade, Humor, Childrens, Chapter Books;http://images.amazon.com/images/P/0060248122.01.LZZZZZZZ.jpg;;;;;;9.0
0060254920;Where the Wild Things Are;Maurice Sendak;1988-01-01;HarperCollins;Childrens;Childrens, Picture Books, Fiction, Classics, Fantasy, Adventure, Young Adult, Animals, Kids, Folklore, Monsters;http://images.amazon.com/images/P/0060254920.01.LZZZZZZZ.jpg;;9.5;9.25;;10.0;
0060256575;The Missing Piece Meets the Big O;Shel Silverstein;1981-01-01;HarperCollins;Childrens;Poetry, Childrens, Picture Books, Fiction, Classics, Inspirational, Sequential Art, Comics, Humor, Young Adult, Philosophy;http://images.amazon.com/images/P/0060256575.01.LZZZZZZZ.jpg;;9.0;10.0;;;
0060256710;The Missing Piece (Ursula Nordstrom Book);Shel Silverstein;1976-01-01;HarperCollins;Poetry;Childrens, Childrens, Picture Books, Fiction, Classics, Young Adult, Humor, Childrens, Juvenile, Inspirational, Childrens, Middle Grade;http://images.amazon.com/images/P/0060256710.01.LZZZZZZZ.jpg;10.0;;;;10.0;
0060504080;Small Wonder : Essays;Barbara Kingsolver;2003-01-01;Perennial;Nonfiction;Writing, Essays, Environment, Nature, Environment, Autobiography, Memoir, Short Stories, Science, Philosophy, Audiobook, Adult;http://images.amazon.com/images/P/0060504080.01.LZZZZZZZ.jpg;;9.5;7.666666666666667;;;
0060506989;We Were Soldiers Once... and Young: Ia Drang--The Battle That Changed the War in Vietnam;Harold G. Moore;2002-01-01;HarperTorch;History;Nonfiction, War, Military Fiction, War, Military, Military History, North American Hi..., American History, Biography, Historical, Autobiography, Memoir, Leadership;http://images.amazon.com/images/P/0060506989.01.LZZZZZZZ.jpg;;7.0;;;;
0060507403;The Cheese Monkeys : A Novel in Two Semesters;Chip Kidd;2002-01-01;Perennial;Fiction;Design, Humor, Art, Novels, Young Adult, Coming Of Age, Art, Art Design, Contemporary, Literary Fiction, Adult;http://images.amazon.com/images/P/0060507403.01.LZZZZZZZ.jpg;5.0;8.153846153846153;9.0;;7.0;
0060507772;The Last Hero : A Discworld Fable;Terry Pratchett;2002-01-01;Eos;Fantasy;Fiction, Humor, Humor, Comedy, Sequential Art, Graphic Novels, Science Fiction Fantasy, Fantasy, Magic, Audiobook, Adventure, Sequential Art, Comics;http://images.amazon.com/images/P/0060507772.01.LZZZZZZZ.jpg;;7.5;7.666666666666667;;10.0;9.0
0060509058;Travels;Michael Crichton;2002-01-01;Perennial;Nonfiction;Travel, Biography, Autobiography, Memoir, Biography, Autobiography, Biography Memoir, Adventure, Travel, Travelogue, History, Thriller;http://images.amazon.com/images/P/0060509058.01.LZZZZZZZ.jpg;;;;;7.0;
0060510854;Caesar;Colleen McCullough;2003-01-01;Avon Books;Historical;Historical Fiction, Fiction, Historical, Roman, History, Ancient History, Cultural, Italy, War, Literature, Novels, Politics;http://images.amazon.com/images/P/0060510854.01.LZZZZZZZ.jpg;;8.0;8.0;;;
0060510862;The Forever War;Joe Haldeman;2003-01-01;Eos;Science Fiction;Fiction, War, Science Fiction Fantasy, War, Military Fiction, Space, Space Opera, Classics, Science Fiction, Time Travel, Space, Speculative Fiction;http://images.amazon.com/images/P/0060510862.01.LZZZZZZZ.jpg;;;6.0;;;
0060512180;The Beauty Myth : How Images of Beauty Are Used Against Women;Naomi Wolf;2002-01-01;Perennial;Feminism;Nonfiction, Sociology, Womens, Psychology, Gender, Gender, Gender Studies, Politics, Philosophy, Self Help;http://images.amazon.com/images/P/0060512180.01.LZZZZZZZ.jpg;;9.0;;;;
0060512806;Cryptonomicon;Neal Stephenson;2002-01-01;Avon Books;Fiction;Science Fiction, Historical, Historical Fiction, Science Fiction, Cyberpunk, Thriller, Historical, War, Science Fiction Fantasy, Fantasy, Novels;http://images.amazon.com/images/P/0060512806.01.LZZZZZZZ.jpg;;9.0;7.0;;8.0;7.5
0060516054;What Went Wrong? : The Clash Between Islam and Modernity in the Middle East;Bernard Lewis;2003-01-01;Perennial;History;Nonfiction, Religion, Islam, Politics, Religion, Sociology, History, World History, Historical, Cultural, Earth, The World;http://images.amazon.com/images/P/0060516054.01.LZZZZZZZ.jpg;;5.0;9.0;;;6.0
0060517611;The Lady in Question;Victoria Alexander;2003-01-01;Avon;Romance;Historical Romance, Romance, Historical, Historical, Regency, Historical, Historical Fiction, Historical Romance, Regency Romance, Fiction, European Literature, British Literature, Adult, Audiobook;http://images.amazon.com/images/P/0060517611.01.LZZZZZZZ.jpg;;7.111111111111111;7.0;;;10.0
0060518510;The Hand of Dinotopia (Dinotopia);Alan Dean Foster;2002-01-01;Avon Books;Fantasy;Fiction, Animals, Dinosaurs, Adventure, Science Fiction, Young Adult, Childrens, Science Fiction Fantasy, Young Adult, Young Adult Fantasy, Science Fiction, Alternate History;http://images.amazon.com/images/P/0060518510.01.LZZZZZZZ.jpg;;;7.0;;;
0060519134;Savannah Blues;Mary Kay Andrews;2003-01-01;Perennial;Womens Fiction;Chick Lit, Mystery, Fiction, Romance, American, Southern, Humor, Contemporary, Audiobook, Mystery, Cozy Mystery, Adult;http://images.amazon.com/images/P/0060519134.01.LZZZZZZZ.jpg;;7.0;8.0;;;7.0
0060521228;The Whipping Boy;Sid Fleischman;2003-01-01;HarperTrophy;Historical;Historical Fiction, Fiction, Childrens, Young Adult, Childrens, Middle Grade, Classics, Adventure, Historical, Childrens, Juvenile, Fantasy;http://images.amazon.com/images/P/0060521228.01.LZZZZZZZ.jpg;;;9.0;;;10.0
0060524944;Murder Unleashed;Lee Charles Kelley;2003-01-01;Avon;Mystery;Cozy Mystery, Animals, Dogs, Mystery, Fiction;http://images.amazon.com/images/P/0060524944.01.LZZZZZZZ.jpg;;7.0;;;;
006052510X;Happiness : A Novel;Will Ferguson;2003-01-01;Perennial;Fiction;Cultural, Canada, Humor, Novels, Contemporary, Literature, Humor, Comedy, Adult, Adult Fiction, Self Help;http://images.amazon.com/images/P/006052510X.01.LZZZZZZZ.jpg;9.0;7.0;7.0;;;
0060530839;The Lion, the Witch and the Wardrobe Color Gift Edition (Narnia);C. S. Lewis;2003-01-01;HarperCollins;Fantasy;Classics, Fiction, Young Adult, Childrens, Childrens, Middle Grade, Adventure, Christian, Fantasy, Magic, Christian Fiction;http://images.amazon.com/images/P/0060530839.01.LZZZZZZZ.jpg;;;;;;10.0
0060534044;Kisscut;Karin Slaughter;2003-01-01;HarperTorch;Mystery;Thriller, Mystery, Crime, Fiction, Thriller, Mystery Thriller, Suspense, Audiobook, Adult, Mystery, Detective, Contemporary;http://images.amazon.com/images/P/0060534044.01.LZZZZZZZ.jpg;;;6.833333333333333;;;7.5
0060534052;A Faint Cold Fear: A Novel;Karin Slaughter;2004-01-01;HarperTorch;Mystery;Thriller, Mystery, Crime, Fiction, Suspense, Thriller, Mystery Thriller, Audiobook, Adult, Mystery, Detective, Contemporary;http://images.amazon.com/images/P/0060534052.01.LZZZZZZZ.jpg;;;;;;9.0
0060535032;City of the Beasts;Isabel Allende;2004-01-01;Rayo;Fantasy;Young Adult, Fiction, Adventure, Magical Realism, European Literature, Spanish Literature, Novels, Childrens, Romance, Mystery;http://images.amazon.com/images/P/0060535032.01.LZZZZZZZ.jpg;5.0;9.0;;;;
006054094X;1421 : The Year China Discovered America;Gavin Menzies;2004-01-01;Perennial;History;Nonfiction, Cultural, China, Cultural, Asia, Historical, History, World History, Travel, North American Hi..., American History, Science, Leadership;http://images.amazon.com/images/P/006054094X.01.LZZZZZZZ.jpg;;;;;;7.0
0060541814;The Andromeda Strain;Michael Crichton;2003-01-01;Avon Books;Science Fiction;Fiction, Thriller, Science Fiction Fantasy, Mystery, Horror, Suspense, Novels, Classics, Audiobook;http://images.amazon.com/images/P/0060541814.01.LZZZZZZZ.jpg;;;;;;8.5
0060541830;Congo;Michael Crichton;2003-01-01;Avon Books;Fiction;Science Fiction, Thriller, Adventure, Horror, Mystery, Suspense, Cultural, Africa, Novels, Thriller, Mystery Thriller;http://images.amazon.com/images/P/0060541830.01.LZZZZZZZ.jpg;;8.0;;;;
006054564X;My Invented Country : A Nostalgic Journey Through Chile;Isabel Allende;2003-01-01;HarperCollins;Nonfiction;Autobiography, Memoir, Biography, Travel, History, European Literature, Spanish Literature, Biography Memoir, Biography, Autobiography, Cultural, Latin American, Historical;http://images.amazon.com/images/P/006054564X.01.LZZZZZZZ.jpg;;;;;8.0;
0060548282;The Wicked Day : Book Four of the Arthurian Saga (The Arthurian Saga, Book 4);Mary Stewart;2003-01-01;Eos (Trade);Fantasy;Fiction, Historical, Historical Fiction, Mythology, Arthurian, Historical, Fantasy, Mythology, Science Fiction Fantasy, Historical Fiction, Historical Fantasy, Historical, Medieval, European Literature, British Literature;http://images.amazon.com/images/P/0060548282.01.LZZZZZZZ.jpg;;;10.0;;;
0060557818;Neverwhere : A Novel;Neil Gaiman;2003-01-01;Perennial;Fantasy;Fiction, Fantasy, Urban Fantasy, Audiobook, Science Fiction Fantasy, Science Fiction, Horror, Adventure, Adult, Young Adult;http://images.amazon.com/images/P/0060557818.01.LZZZZZZZ.jpg;;7.666666666666667;7.5;;10.0;
006056668X;Fluke : Or, I Know Why the Winged Whale Sings;Christopher Moore;2004-01-01;Perennial;Fiction;Humor, Fantasy, Humor, Comedy, Science Fiction, Adult, Audiobook, Adult Fiction, Fantasy, Urban Fantasy, Contemporary;http://images.amazon.com/images/P/006056668X.01.LZZZZZZZ.jpg;;7.0;10.0;;;
0060567236;Lord of Light;Roger Zelazny;2004-01-01;Eos;Science Fiction;Fantasy, Fiction, Science Fiction Fantasy, Fantasy, Mythology, Classics, Hugo Awards, Religion, Speculative Fiction, Novels;http://images.amazon.com/images/P/0060567236.01.LZZZZZZZ.jpg;;;;;;10.0
0060572345;Where the Sidewalk Ends 30th Anniversary Special Edition : Poems and Drawings;Shel Silverstein;2004-01-01;HarperCollins;Poetry;Childrens, Classics, Fiction, Humor, Young Adult, Childrens, Picture Books, Childrens, Middle Grade, Childrens, Juvenile, Fantasy;http://images.amazon.com/images/P/0060572345.01.LZZZZZZZ.jpg;;;10.0;;;
0060572965;Dead Witch Walking;Kim Harrison;2004-01-01;HarperTorch;Fantasy;Urban Fantasy, Fantasy, Fantasy, Paranormal, Paranormal, Vampires, Paranormal, Witches, Fantasy, Magic, Fiction, Fantasy, Supernatural, Romance, Paranormal Romance, Romance;http://images.amazon.com/images/P/0060572965.01.LZZZZZZZ.jpg;;9.5;;;8.5;9.5
0060574216;Men Are from Mars, Women Are from Venus : The Classic Guide to Understanding the Opposite Sex;John Gray;2004-01-01;Perennial Currents;Nonfiction;Self Help, Psychology, Relationships, Self Help, Personal Development, Marriage, Philosophy, Romance, Unfinished, Audiobook;http://images.amazon.com/images/P/0060574216.01.LZZZZZZZ.jpg;;;7.0;;;
0060575816;Sabriel (adult edition) (The Abhorsen Trilogy);Garth Nix;2004-01-01;Eos;Fantasy;Young Adult, Fiction, Fantasy, Magic, Young Adult, Young Adult Fantasy, Fantasy, High Fantasy, Adventure, Audiobook, Science Fiction Fantasy, Young Adult, Teen;http://images.amazon.com/images/P/0060575816.01.LZZZZZZZ.jpg;8.0;10.0;;;;
0060584750;Mystic River;Dennis Lehane;2003-01-01;Perennial Dark Alley;Mystery;Fiction, Thriller, Mystery, Crime, Thriller, Mystery Thriller, Suspense, Drama, Audiobook, Novels, Mystery, Detective;http://images.amazon.com/images/P/0060584750.01.LZZZZZZZ.jpg;;;9.0;;9.0;
0060586370;The Way the Crow Flies : A Novel;Ann-Marie MacDonald;2004-01-01;Perennial;Fiction;Historical, Historical Fiction, Cultural, Canada, Mystery, Historical, Literary Fiction, Contemporary, Adult Fiction, Literature, Canadian Literature, Book Club;http://images.amazon.com/images/P/0060586370.01.LZZZZZZZ.jpg;;8.0;;;;
0060595183;The Doors of Perception and Heaven and Hell (Perennial Classics);Aldous Huxley;2004-01-01;Perennial Classics;Philosophy;Nonfiction, Psychology, Classics, Writing, Essays, Spirituality, Science, Religion, Literature, European Literature, British Literature;http://images.amazon.com/images/P/0060595183.01.LZZZZZZZ.jpg;;6.0;;;6.0;
0060595361;Since You're Leaving Anyway, Take Out the Trash;Dixie Cash;2004-01-01;Avon;Mystery;Romance, Womens Fiction, Chick Lit, Humor, Fiction, Contemporary, Mystery, Cozy Mystery, Romance, Contemporary Romance, American, Southern, Adult;http://images.amazon.com/images/P/0060595361.01.LZZZZZZZ.jpg;;;;;;10.0
0060598891;The Rocky Road to Romance;Janet Evanovich;2004-01-01;HarperTorch;Romance;Womens Fiction, Chick Lit, Fiction, Romance, Contemporary Romance, Contemporary, Humor, Mystery, Audiobook, Humor, Comedy, Adult;http://images.amazon.com/images/P/0060598891.01.LZZZZZZZ.jpg;;;;;;8.0
0060609176;Meeting Jesus Again for the First Time : The Historical Jesus and the Heart of Contemporary Faith;Marcus J. Borg;1995-01-01;HarperSanFrancisco;Religion;Nonfiction, Spirituality, Religion, Theology, Religion, Christianity, Christian, Religion, Faith, History, Philosophy, Academic, College;http://images.amazon.com/images/P/0060609176.01.LZZZZZZZ.jpg;;10.0;;;;8.0
0060652896;The Screwtape Letters (Gift Edition);C. S. Lewis;2001-01-01;Harper SanFrancisco;Fiction;Classics, Christian, Religion, Religion, Christianity, Fantasy, Religion, Theology, Christian Fiction, Religion, Faith, Philosophy;http://images.amazon.com/images/P/0060652896.01.LZZZZZZZ.jpg;;8.0;;;;
0060652926;Mere Christianity;C. S. Lewis;2001-01-01;Harper SanFrancisco;Christian;Nonfiction, Religion, Religion, Theology, Religion, Christianity, Classics, Philosophy, Religion, Faith, Spirituality, Christian, Christian Living;http://images.amazon.com/images/P/0060652926.01.LZZZZZZZ.jpg;;1.0;10.0;;;9.5
0060727535;Cash : The Autobiography;Johnny Cash;2003-01-01;Harper SanFrancisco;Music;Biography, Nonfiction, Autobiography, Memoir, Biography, Autobiography, Biography Memoir, History, Culture, Pop Culture, Music, Musicians, Biography, Music Biography;http://images.amazon.com/images/P/0060727535.01.LZZZZZZZ.jpg;;8.5;;;;
0060730552;Touching the Void: The True Story of One Man's Miraculous Survival;Joe Simpson;2004-01-01;Perennial Currents;Nonfiction;Adventure, Biography, Sports, Mountaineering, Travel, Autobiography, Memoir, Adventure, Survival, Mountaineering, Climbing, Nature, Outdoors, Sports, Sports;http://images.amazon.com/images/P/0060730552.01.LZZZZZZZ.jpg;;10.0;;;;
