ISBN;Book-Title;Book-Author;Year-Of-Publication;Publisher;Genre Principal;Genres Secondaires;Image-URL-L;Moyenne_Adolescent 12-17;Moyenne_Adulte 26-35;Moyenne_Adulte 36-50;Moyenne_Enfant 1-12;Moyenne_Jeune adulte 18-25;Moyenne_Senior 50+
0316769177;The Catcher in the Rye;J.D. Salinger;2001-01-01;Back Bay Books;Classics;Fiction, Young Adult, Literature, Academic, School, Novels, Young Adult, Coming Of Age, Young Adult, High School, Literature, American, Academic, Read For School;http://images.amazon.com/images/P/0316769177.01.LZZZZZZZ.jpg;8.0;8.0;;;9.0;
0316779237;Holidays on Ice : Stories;David Sedaris;1998-01-01;Back Bay Books;Humor;Nonfiction, Short Stories, Autobiography, Memoir, Writing, Essays, Holiday, Christmas, Audiobook, Humor, Comedy, Holiday, Biography;http://images.amazon.com/images/P/0316779237.01.LZZZZZZZ.jpg;;8.263157894736842;7.2;;10.0;9.0
0316787531;Our Band Could Be Your Life: Scenes from the American Indie Underground 1981-1991;Michael Azerrad;2002-01-01;Back Bay Books;Music;Nonfiction, History, Biography, Music, Punk, Writing, Journalism, Culture, Pop Culture, Art, Cultural, The United States Of America;http://images.amazon.com/images/P/0316787531.01.LZZZZZZZ.jpg;;;9.0;;;
0316890669;Dale Loves Sophie to Death: A Novel;Robb Forman Dew;2001-01-01;Back Bay Books;Fiction;Novels, Literature;http://images.amazon.com/images/P/0316890669.01.LZZZZZZZ.jpg;;5.0;;;;8.0
0316910333;Gossip Girl #1 : A Novel by Cecily von Ziegesar (Gossip Girl);Cecily Von Ziegesar;2002-01-01;Little, Brown;Young Adult;Womens Fiction, Chick Lit, Fiction, Contemporary, Romance, Young Adult, Teen, Realistic Fiction, Drama, Young Adult, High School, Literature, Banned Books;http://images.amazon.com/images/P/0316910333.01.LZZZZZZZ.jpg;7.5;10.0;7.0;;6.9;
0316911488;You Know You Love Me: A Gossip Girl Novel;Cecily von Ziegesar;2002-01-01;Little, Brown;Young Adult;Womens Fiction, Chick Lit, Fiction, Contemporary, Romance, Young Adult, Teen, Young Adult, High School, Drama, Realistic Fiction, Young Adult, Young Adult Contemporary;http://images.amazon.com/images/P/0316911488.01.LZZZZZZZ.jpg;8.0;;;;8.666666666666666;
0316912123;All I Want Is Everything (Gossip Girl, 3);Cecily von Ziegesar;2003-01-01;Little, Brown;Young Adult;Womens Fiction, Chick Lit, Fiction, Contemporary, Romance, Young Adult, Teen, Young Adult, High School, Young Adult, Young Adult Contemporary, Realistic Fiction, Drama;http://images.amazon.com/images/P/0316912123.01.LZZZZZZZ.jpg;8.0;;;;10.0;
0316919896;A Supposedly Fun Thing I'll Never Do Again : Essays and Arguments Tag: Author of Infinite Jest;David Foster Wallace;1997-01-01;Little, Brown;Nonfiction;Writing, Essays, Humor, Short Stories, Autobiography, Memoir, Literature, American, Philosophy, Literature, Travel, Unfinished;http://images.amazon.com/images/P/0316919896.01.LZZZZZZZ.jpg;;6.333333333333333;;;;
0316925284;A Supposedly Fun Thing I'll Never Do Again : Essays and Arguments Tag: Author of Infinite Jest;David Foster Wallace;1998-01-01;Back Bay Books;Nonfiction;Writing, Essays, Humor, Short Stories, Autobiography, Memoir, Literature, American, Philosophy, Literature, Travel, Unfinished;http://images.amazon.com/images/P/0316925284.01.LZZZZZZZ.jpg;;8.0;;;;
0316926345;Brideshead Revisited;Evelyn Waugh;1999-01-01;Back Bay Books;Classics;Fiction, Historical, Historical Fiction, Literature, European Literature, British Literature, Novels, LGBT, Literature, 20th Century, Literary Fiction, Historical;http://images.amazon.com/images/P/0316926345.01.LZZZZZZZ.jpg;;8.333333333333334;7.0;;;8.0
0316954993;War and Remembrance;Herman Wouk;2002-01-01;Back Bay Books;Historical;Historical Fiction, Fiction, War, World War II, War, Historical, Classics, World War II, Holocaust, War, Military Fiction, Audiobook, Literature, Jewish;http://images.amazon.com/images/P/0316954993.01.LZZZZZZZ.jpg;;;8.0;;;7.0
0316955124;Don't Stop the Carnival : A Novel;Herman Wouk;1992-01-01;Back Bay Books;Fiction;Humor, Travel, Literature, Classics, Novels, Literary Fiction, Contemporary, Humor, Comedy, Literature, American;http://images.amazon.com/images/P/0316955124.01.LZZZZZZZ.jpg;;10.0;9.0;;;
0316955132;Marjorie Morningstar;Herman Wouk;1992-01-01;Back Bay Books;Fiction;Classics, Historical, Historical Fiction, Romance, Literature, Jewish, Young Adult, Coming Of Age, New York, Novels, Literary Fiction, Literature, American;http://images.amazon.com/images/P/0316955132.01.LZZZZZZZ.jpg;;10.0;;;;9.333333333333334
0316969680;The Beach House;James Patterson;2002-01-01;Little, Brown;Mystery;Fiction, Thriller, Mystery, Crime, Suspense, Thriller, Mystery Thriller, Mystery, Murder Mystery, Adult, Audiobook, Adult Fiction;http://images.amazon.com/images/P/0316969680.01.LZZZZZZZ.jpg;;6.206896551724138;7.041666666666667;8.0;7.0;7.666666666666667
0330375466;Them;Jon Ronson;2001-01-01;Picador;Nonfiction;Politics, Writing, Journalism, Humor, Audiobook, Sociology, Psychology, Religion, History, Writing, Essays;http://images.amazon.com/images/P/0330375466.01.LZZZZZZZ.jpg;;5.0;7.0;;;
033039780X;Forever;Judy Blume;2001-01-01;Macmillan Children's Books;Young Adult;Romance, Fiction, Contemporary, Young Adult, Teen, Classics, Young Adult, Coming Of Age, Womens Fiction, Chick Lit, Literature, Banned Books, Realistic Fiction;http://images.amazon.com/images/P/033039780X.01.LZZZZZZZ.jpg;6.0;;;;;
0330397966;The Butterfly Tattoo;Philip Pullman;2001-01-01;Macmillan Children's Books;Young Adult;Fiction, Romance, Mystery, Contemporary, Childrens, Fantasy, Thriller, European Literature, British Literature, Audiobook;http://images.amazon.com/images/P/0330397966.01.LZZZZZZZ.jpg;;;;;;6.0
0330491199;The Hitch Hiker's Guide to the Galaxy (The Hitch Hiker's Guide to the Galaxy);Douglas Adams;2002-01-01;Pan Macmillan;Science Fiction;Fiction, Humor, Classics, Fantasy, Humor, Comedy, Science Fiction Fantasy, Audiobook, Adventure, Novels;http://images.amazon.com/images/P/0330491199.01.LZZZZZZZ.jpg;;8.0;;;8.666666666666666;
0340796146;The Famous Five 1: Five on a Treasure Island (Famous Five);Enid Blyton;2001-01-01;Hodder & Stoughton Childrens Division;Childrens;Fiction, Adventure, Mystery, Classics, Young Adult, Childrens, Middle Grade, Novels, European Literature, British Literature, Childrens, Juvenile;http://images.amazon.com/images/P/0340796146.01.LZZZZZZZ.jpg;;6.0;;;;
0345253590;The Best of Philip K. Dick;Philip K. Dick;1977-01-01;Del Rey Books;Science Fiction;Short Stories, Fiction, Science Fiction Fantasy, Anthologies, Fantasy, Literature, Classics, Anthologies, Collections;http://images.amazon.com/images/P/0345253590.01.LZZZZZZZ.jpg;;6.0;;;;
0345285549;Elfstones of Shannara;Terry Brooks;1990-01-01;Del Rey Books;Fantasy;Fiction, Fantasy, Epic Fantasy, Science Fiction Fantasy, Fantasy, High Fantasy, Adventure, Young Adult, Fantasy, Magic, Adult, Science Fiction;http://images.amazon.com/images/P/0345285549.01.LZZZZZZZ.jpg;9.0;6.055555555555555;6.0;;;
0345301110;Story of O;Pauline Reage;1989-01-01;Ballantine Books;Adult Fiction;Erotica, Fiction, Classics, Erotica, BDSM, Romance, Cultural, France, Sexuality, Adult, Literature, European Literature, French Literature;http://images.amazon.com/images/P/0345301110.01.LZZZZZZZ.jpg;;6.956521739130435;6.666666666666667;;7.75;8.0
0345302354;The Crucible of Time;John Brunner;1988-01-01;Del Rey Books;Science Fiction;Fiction, Science Fiction, Time Travel, Fantasy, Science Fiction Fantasy, Adventure, Science Fiction, Aliens, Novels, Space, Speculative Fiction;http://images.amazon.com/images/P/0345302354.01.LZZZZZZZ.jpg;;8.0;;;;
0345305183;On a Pale Horse;Piers Anthony;1984-01-01;Ballantine Books;Fantasy;Fiction, Science Fiction, Science Fiction Fantasy, Fantasy, Urban Fantasy, Fantasy, Magic, Fantasy, Paranormal, Death, Audiobook, Fantasy, Mythology;http://images.amazon.com/images/P/0345305183.01.LZZZZZZZ.jpg;;8.666666666666666;8.666666666666666;;9.0;10.0
0345314034;More Classic Italian Cooking;Marcella Hazan;1984-01-01;Ballantine Books;Food and Drink;Cookbooks, Food and Drink, Cooking, Food and Drink, Food, European Literature, Italian Literature, Nonfiction;http://images.amazon.com/images/P/0345314034.01.LZZZZZZZ.jpg;;;;;;5.0
0345316509;Job: A Comedy of Justice;Robert A. Heinlein;1990-01-01;Del Rey Books;Science Fiction;Fiction, Fantasy, Science Fiction Fantasy, Humor, Religion, Speculative Fiction, Humor, Comedy, Adventure, Novels;http://images.amazon.com/images/P/0345316509.01.LZZZZZZZ.jpg;;6.923076923076923;8.88888888888889;;7.666666666666667;7.5
0345317572;Magic Kingdom for Sale-Sold!;Terry Brooks;1986-01-01;Ballantine Books;Fantasy;Fiction, Science Fiction Fantasy, Humor, Fantasy, Magic, Adventure, Young Adult, Fantasy, High Fantasy, Fantasy, Dragons, Fantasy, Epic Fantasy;http://images.amazon.com/images/P/0345317572.01.LZZZZZZZ.jpg;;;7.0;;;
0345321383;Bridge of Birds;Barry Hughart;1990-01-01;Del Rey Books;Fantasy;Fiction, Historical, Historical Fiction, Cultural, China, Humor, Historical, Mystery, Adventure, Science Fiction, Alternate History, Cultural, Asia;http://images.amazon.com/images/P/0345321383.01.LZZZZZZZ.jpg;7.0;8.5;8.0;;;
0345323882;Blade Runner (R);Philip K. Dick;1982-01-01;Ballantine Books;Science Fiction;Fiction, Classics, Science Fiction, Dystopia, Science Fiction, Cyberpunk, Science Fiction Fantasy, Fantasy, Novels, Speculative Fiction, Literature, American;http://images.amazon.com/images/P/0345323882.01.LZZZZZZZ.jpg;;;8.0;;;
0345329457;At the Mountains of Madness and Other Tales;H. P. Lovecraft;1990-01-01;Del Rey Books;Horror;Fiction, Fantasy, Short Stories, Classics, Science Fiction, Horror, Lovecraftian, Lovecraftian, Cthulhu Mythos, Fantasy, Weird Fiction, Literature;http://images.amazon.com/images/P/0345329457.01.LZZZZZZZ.jpg;;;9.0;;;
0345331052;The Doom That Came to Sarnath;H. P. Lovecraft;1990-01-01;Del Rey Books;Horror;Fantasy, Short Stories, Fiction, Horror, Lovecraftian, Lovecraftian, Cthulhu Mythos, Science Fiction, Fantasy, Weird Fiction, Classics, Mystery;http://images.amazon.com/images/P/0345331052.01.LZZZZZZZ.jpg;;;;;;10.0
0345335287;The Black Unicorn (Magic Kingdom of Landover Novel);Terry Brooks;1990-01-01;Del Rey Books;Fantasy;Fiction, Science Fiction Fantasy, Fantasy, Magic, Adventure, Humor, Fantasy, High Fantasy, Fantasy, Epic Fantasy, Young Adult, Adult;http://images.amazon.com/images/P/0345335287.01.LZZZZZZZ.jpg;5.0;6.833333333333333;8.0;;7.0;
0345345061;The Tolkien Reader;J. R. R. Tolkien;1989-01-01;Del Rey Books;Fantasy;Fiction, Short Stories, Poetry, Classics, Writing, Essays, Science Fiction Fantasy, Literature, Anthologies, Reference;http://images.amazon.com/images/P/0345345061.01.LZZZZZZZ.jpg;9.0;;;;10.0;
0345346297;The Dragons of Eden: Speculations on the Evolution of Human Intelligence;Carl Sagan;1989-01-01;Ballantine Books;Science;Nonfiction, Philosophy, Biology, Evolution, Science, Biology, Psychology, History, Anthropology, Science, Popular Science, Biology, Neuroscience;http://images.amazon.com/images/P/0345346297.01.LZZZZZZZ.jpg;;;9.0;;7.0;7.0
0345350804;The Best of H. P. Lovecraft: Bloodcurdling Tales of Horror and the Macabre;H.P. Lovecraft;1987-01-01;Del Rey;Horror;Fiction, Short Stories, Classics, Fantasy, Science Fiction, Anthologies, Horror, Lovecraftian, Fantasy, Weird Fiction, Literature;http://images.amazon.com/images/P/0345350804.01.LZZZZZZZ.jpg;;6.666666666666667;8.75;;8.0;
0345354648;Five Patients;MICHAEL CRICHTON;1989-01-01;Ballantine Books;Nonfiction;Medical, Health, Medicine, Science, Thriller, Autobiography, Memoir, Drama, Health, Thriller, Mystery Thriller, Mystery;http://images.amazon.com/images/P/0345354648.01.LZZZZZZZ.jpg;;7.090909090909091;7.5;;5.0;
0345355237;The Surveillance;Julian May;1988-01-01;Del Rey Books;Science Fiction;Fiction, Fantasy, Science Fiction Fantasy, Speculative Fiction, Science Fiction, Dystopia, Fantasy, Paranormal;http://images.amazon.com/images/P/0345355237.01.LZZZZZZZ.jpg;;6.5;10.0;;;
0345355245;Metaconcert (Intervention, No 2);Julian May;1989-01-01;Del Rey Books;Science Fiction;Fantasy, Fiction, Science Fiction Fantasy, Speculative Fiction, Fantasy, Paranormal;http://images.amazon.com/images/P/0345355245.01.LZZZZZZZ.jpg;;6.5;10.0;;;
0345360354;Lovely in Her Bones;Sharyn McCrumb;1990-01-01;Ballantine Books;Mystery;Fiction, Thriller, Mystery Thriller, Mystery, Cozy Mystery, Thriller, Humor, History, Archaeology, American, Southern, Suspense, Mystery, Crime;http://images.amazon.com/images/P/0345360354.01.LZZZZZZZ.jpg;;;7.5;;;
0345362497;Magnificat (Galactic Milieu Trilogy, No 3);Julian May;1997-01-01;Del Rey Books;Science Fiction;Fantasy, Fiction, Science Fiction Fantasy, Space, Space Opera, Speculative Fiction, Sci Fi Fantasy, Anthologies, Collections, Fantasy, Paranormal, Philosophy, Metaphysics;http://images.amazon.com/images/P/0345362497.01.LZZZZZZZ.jpg;;6.0;10.0;;;
0345368436;Starship Titanic;Terry Jones;1998-01-01;Ballantine Books;Science Fiction;Fiction, Humor, Fantasy, Humor, Comedy, Science Fiction Fantasy, Space, Adventure, Novels, Science Fiction, Aliens;http://images.amazon.com/images/P/0345368436.01.LZZZZZZZ.jpg;;7.5;8.0;;7.5;
0345369076;Silver Pigs: A Detective Novel in Ancient Rome;Lindsey Davis;1992-01-01;Fawcett Books;Historical;Historical Fiction, Mystery, Fiction, Historical, Mystery, Crime, Mystery, Historical Mystery, Mystery, Detective, Cultural, Italy, Roman, Thriller, Mystery Thriller;http://images.amazon.com/images/P/0345369076.01.LZZZZZZZ.jpg;;9.333333333333334;8.5;;;10.0
034537147X;The Case of the Half-Wakened Wife (A Perry Mason Mystery);Erle Stanley Gardner;1991-01-01;Fawcett Books;Mystery;Fiction, Mystery, Crime, Mystery, Detective, Novels, Thriller, Mystery Thriller;http://images.amazon.com/images/P/034537147X.01.LZZZZZZZ.jpg;;5.0;;;;
0345375211;The Book of Lost Tales 1 (The History of Middle-Earth - Volume 1);J. R. R. Tolkien;1992-01-01;Del Rey Books;Fantasy;Fiction, Classics, Fantasy, High Fantasy, Science Fiction Fantasy, Short Stories, Fantasy, Epic Fantasy, Adventure, Fantasy, Mythology, Literature;http://images.amazon.com/images/P/0345375211.01.LZZZZZZZ.jpg;10.0;6.0;5.5;;6.666666666666667;8.0
0345376048;The Feast of All Saints;Anne Rice;1992-01-01;Ballantine Books;Fiction;Historical, Historical Fiction, Horror, Fantasy, Historical, Fantasy, Paranormal, Paranormal, Vampires, Fantasy, Supernatural, American, Southern, Novels;http://images.amazon.com/images/P/0345376048.01.LZZZZZZZ.jpg;;8.0;;;;
0345381114;Return of the Straight Dope;CECIL ADAMS;1994-01-01;Ballantine Books;Reference;Trivia, Nonfiction, Reference, Humor;http://images.amazon.com/images/P/0345381114.01.LZZZZZZZ.jpg;;;;;8.0;8.0
0345384210;The Dream Cycle of H.P. Lovecraft: Dreams of Terror and Death;H. P. Lovecraft;1995-01-01;Del Rey Books;Horror;Fiction, Fantasy, Short Stories, Classics, Horror, Lovecraftian, Science Fiction, Anthologies, Fantasy, Weird Fiction, Lovecraftian, Cthulhu Mythos;http://images.amazon.com/images/P/0345384210.01.LZZZZZZZ.jpg;;9.0;8.0;;10.0;
0345384229;The Transition of H. P. Lovecraft: The Road to Madness;H. P. Lovecraft;1996-01-01;Del Rey Books;Horror;Fiction, Short Stories, Fantasy, Classics, Horror, Lovecraftian, Fantasy, Weird Fiction, Anthologies, Science Fiction, Lovecraftian, Cthulhu Mythos;http://images.amazon.com/images/P/0345384229.01.LZZZZZZZ.jpg;;10.0;;;;
0345384563;A History of God: The 4,000-Year Quest of Judaism, Christianity and Islam;Karen Armstrong;1994-01-01;Ballantine Books;Religion;History, Nonfiction, Philosophy, Religion, Islam, Spirituality, Religion, Theology, Religion, Christianity, Religion, Judaism, Religion, Faith;http://images.amazon.com/images/P/0345384563.01.LZZZZZZZ.jpg;;8.5;9.0;;;
0345391691;The Battle for God;Karen Armstrong;2001-01-01;Ballantine Books;Religion;History, Nonfiction, Philosophy, Religion, Theology, Spirituality, Religion, Christianity, Religion, Islam, Politics, Religion, Judaism;http://images.amazon.com/images/P/0345391691.01.LZZZZZZZ.jpg;;8.0;7.0;;;6.0
0345395182;The Sagittarius Whorl: An Adventure of the Rampart Worlds (Rampart Worlds);Julian May;2001-01-01;Del Rey Books;Science Fiction;Space, Space Opera, Fantasy, Fiction, Science Fiction Fantasy;http://images.amazon.com/images/P/0345395182.01.LZZZZZZZ.jpg;;;5.0;;;
0345396537;First King of Shannara;Terry Brooks;1997-01-01;Del Rey Books;Fantasy;Fiction, Fantasy, Epic Fantasy, Science Fiction Fantasy, Fantasy, High Fantasy, Adventure, Fantasy, Magic, Epic, Science Fiction, Adult;http://images.amazon.com/images/P/0345396537.01.LZZZZZZZ.jpg;;5.0;;;9.0;
0345396685;When Christ and His Saints Slept;Sharon Kay Penman;1996-01-01;Ballantine Books;Historical;Historical Fiction, Fiction, Historical, Historical, Medieval, European Literature, British Literature, Literature, 12th Century, Historical, Plantagenet, Cultural, France, Romance, War;http://images.amazon.com/images/P/0345396685.01.LZZZZZZZ.jpg;;;10.0;;;9.0
0345396707;The Waterborn (Chosen of the Changeling, Book 1);J. GREGORY KEYES;1997-01-01;Del Rey;Fantasy;Fantasy, High Fantasy, Fiction, Science Fiction Fantasy, Adult, Fantasy, Mythology, Adventure, Science Fiction, Heroic Fantasy, Sword and Sorcery, Mythology, Gods;http://images.amazon.com/images/P/0345396707.01.LZZZZZZZ.jpg;;;;;9.0;
0345396936;Cry to Heaven;Anne Rice;1995-01-01;Ballantine Books;Fiction;Historical, Historical Fiction, Horror, Historical, Fantasy, Romance, LGBT, Fantasy, Paranormal, Cultural, Italy, Romance, M M Romance;http://images.amazon.com/images/P/0345396936.01.LZZZZZZZ.jpg;;7.125;8.916666666666666;;8.125;6.0
0345397398;The Vampire Companion: The Official Guide to Anne Rice's the Vampire Chronicles;Katherine Ramsland;1995-01-01;Ballantine Books;Paranormal;Vampires, Horror, Nonfiction, Reference, Fantasy, Paranormal, Fantasy, Supernatural, Gothic, Fantasy, Urban Fantasy, Horror, Gothic Horror, Games, Gaming;http://images.amazon.com/images/P/0345397398.01.LZZZZZZZ.jpg;;;;;8.0;
0345406443;Mid-Flinx;Alan Dean Foster;1996-01-01;Del Rey Books;Science Fiction;Fantasy, Fiction, Science Fiction Fantasy, Adventure, Space, Space Opera, Science Fiction, Aliens, Young Adult, Space, Mystery;http://images.amazon.com/images/P/0345406443.01.LZZZZZZZ.jpg;;;;;;9.0
0345407865;The Children of Henry VIII;Alison Weir;1997-01-01;Ballantine Books;History;Nonfiction, Biography, English History, Tudor Period, Historical, European Literature, British Literature, History, European History, Literature, 16th Century, Biography Memoir, Audiobook;http://images.amazon.com/images/P/0345407865.01.LZZZZZZZ.jpg;;10.0;;;;
0345409469;The Demon-Haunted World: Science As a Candle in the Dark;Carl Sagan;1997-01-01;Ballantine Books;Science;Nonfiction, Philosophy, Religion, History, Philosophy, Skepticism, Religion, Atheism, Science, Popular Science, Psychology, Science, Physics;http://images.amazon.com/images/P/0345409469.01.LZZZZZZZ.jpg;;7.25;9.666666666666666;;6.666666666666667;
034541005X;The Power of One;Bryce Courtenay;1992-01-01;Ballantine Books;Fiction;Historical, Historical Fiction, Cultural, Africa, Classics, Southern Africa, South Africa, Young Adult, Coming Of Age, Historical, Young Adult, Novels, Literature;http://images.amazon.com/images/P/034541005X.01.LZZZZZZZ.jpg;;10.0;;;;
0345412818;Does Anybody Have a Problem with That? The Best of Politically Incorrect;Bill Maher;1997-01-01;Ballantine Books;Politics;Humor, Nonfiction, Humor, Comedy;http://images.amazon.com/images/P/0345412818.01.LZZZZZZZ.jpg;;;5.0;;;
0345413997;The Door into Summer;Robert A. Heinlein;1997-01-01;Del Rey Books;Science Fiction;Fiction, Science Fiction, Time Travel, Science Fiction Fantasy, Fantasy, Classics, Speculative Fiction, Audiobook, Adventure, Novels;http://images.amazon.com/images/P/0345413997.01.LZZZZZZZ.jpg;;;10.0;;;
0345414004;Friday;Robert A. Heinlein;1997-01-01;Del Rey Books;Science Fiction;Fiction, Science Fiction Fantasy, Speculative Fiction, Fantasy, Adventure, Audiobook, Classics, Novels, Space;http://images.amazon.com/images/P/0345414004.01.LZZZZZZZ.jpg;;9.0;10.0;;;
0345416260;Pope Joan (Ballantine Reader's Circle);Donna Woolfolk Cross;1996-01-01;Ballantine Books;Historical;Historical Fiction, Fiction, Historical, Religion, Book Club, Historical, Medieval, Cultural, Italy, Adult, Adult Fiction, Womens;http://images.amazon.com/images/P/0345416260.01.LZZZZZZZ.jpg;;7.809523809523809;8.235294117647058;;8.25;7.5
0345417968;The 158-Pound Marriage (Ballantine Reader's Circle);John Irving;1997-01-01;Ballantine Books;Fiction;Novels, Literary Fiction, Literature, Literature, American, Contemporary, Roman, The United States Of America, Marriage, Adult Fiction;http://images.amazon.com/images/P/0345417968.01.LZZZZZZZ.jpg;;8.0;;;;
0345418263;The Princess Bride: S. Morgenstern's Classic Tale of True Love and High Adventure (Ballantine Reader's Circle);William Goldman;2003-01-01;Ballantine Books;Fantasy;Classics, Fiction, Romance, Humor, Young Adult, Adventure, Humor, Comedy, Science Fiction Fantasy, Fantasy, Fairy Tales;http://images.amazon.com/images/P/0345418263.01.LZZZZZZZ.jpg;;9.0;10.0;;7.666666666666667;9.0
0345418689;Reunion;Alan Dean Foster;2002-01-01;Del Rey Books;Science Fiction;Fiction, Fantasy, Adventure, Science Fiction Fantasy, Space, Space Opera, Young Adult, Science Fiction, Aliens, Space, Mystery;http://images.amazon.com/images/P/0345418689.01.LZZZZZZZ.jpg;;8.0;;;6.0;3.0
0345418905;Life, the Universe and Everything;Douglas Adams;1997-01-01;Ballantine Books;Science Fiction;Fiction, Humor, Fantasy, Humor, Comedy, Science Fiction Fantasy, Classics, Audiobook, Adventure, Novels;http://images.amazon.com/images/P/0345418905.01.LZZZZZZZ.jpg;;;9.0;;;
0345419081;The Eight;KATHERINE NEVILLE;1997-01-01;Ballantine Books;Fiction;Mystery, Historical, Historical Fiction, Thriller, Fantasy, Historical, Adventure, Thriller, Mystery Thriller, Suspense, Romance;http://images.amazon.com/images/P/0345419081.01.LZZZZZZZ.jpg;;10.0;10.0;;5.0;
0345419626;Queen of the Damned (Vampire Chronicles (Paperback));Anne Rice;1997-01-01;Ballantine Books;Horror;Fantasy, Paranormal, Vampires, Fiction, Fantasy, Paranormal, Fantasy, Supernatural, Fantasy, Urban Fantasy, Gothic, Adult, Science Fiction Fantasy;http://images.amazon.com/images/P/0345419626.01.LZZZZZZZ.jpg;;2.0;10.0;;;
0345420748;While I Was Gone;Sue Miller;2002-01-01;Ballantine Books;Fiction;Womens Fiction, Chick Lit, Contemporary, Novels, Mystery, Adult Fiction, Book Club, Literary Fiction, Adult, Drama;http://images.amazon.com/images/P/0345420748.01.LZZZZZZZ.jpg;;;7.117647058823529;;;
0345422406;Merrick (Vampire/Witches Chronicles);Anne Rice;2001-01-01;Ballantine Books;Horror;Paranormal, Vampires, Fantasy, Fiction, Fantasy, Paranormal, Fantasy, Supernatural, Paranormal, Witches, Fantasy, Urban Fantasy, Gothic, Adult;http://images.amazon.com/images/P/0345422406.01.LZZZZZZZ.jpg;;5.111111111111111;8.25;;;7.333333333333333
0345422554;Polgara the Sorceress (Malloreon (Paperback Random House));David Eddings;1999-01-01;Del Rey Books;Fantasy;Fiction, Fantasy, Epic Fantasy, Science Fiction Fantasy, Fantasy, High Fantasy, Fantasy, Magic, Young Adult, Adventure, Adult, Epic;http://images.amazon.com/images/P/0345422554.01.LZZZZZZZ.jpg;9.0;8.666666666666666;7.0;;7.0;
0345423879;Candy;Luke Davies;1998-01-01;Ballantine Books;Fiction;Contemporary, Cultural, Australia, Romance, Health, Mental Health, Novels, Adult Fiction, Drama, Young Adult, Literature;http://images.amazon.com/images/P/0345423879.01.LZZZZZZZ.jpg;;7.5;8.0;;;
034542705X;The Man Who Listens to Horses;Monty Roberts;1998-01-01;Ballantine Books;Nonfiction;Animals, Horses, Animals, Biography, Autobiography, Memoir, Biography, Autobiography, Biography Memoir, Inspirational, Environment, Nature, Adult;http://images.amazon.com/images/P/034542705X.01.LZZZZZZZ.jpg;;;7.5;;8.5;7.0
0345428307;Trust Fund;STEPHEN FREY;2002-01-01;Fawcett;Fiction;Thriller, Mystery, Suspense, Economics, Finance;http://images.amazon.com/images/P/0345428307.01.LZZZZZZZ.jpg;;8.0;8.0;;;7.5
034543191X;The King of Elfland's Daughter (Del Rey Impact);Edward John Moreton Drax Plunkett Dunsany;1999-01-01;Del Rey Books;Fantasy;Classics, Fiction, Fantasy, Fairy Tales, Fantasy, High Fantasy, Science Fiction Fantasy, Romance, Literature, Novels, Fantasy, Epic Fantasy;http://images.amazon.com/images/P/034543191X.01.LZZZZZZZ.jpg;;;10.0;;;6.0
0345432401;Omerta;Mario Puzo;2001-01-01;Ballantine Books;Fiction;Mystery, Crime, Thriller, Mystery, Novels, Classics, Suspense, Historical, Historical Fiction, Action, Drama;http://images.amazon.com/images/P/0345432401.01.LZZZZZZZ.jpg;;7.0;7.0;;;6.0
0345434803;The Vampire Armand (The Vampire Chronicles, Book 6);Anne Rice;2000-01-01;Ballantine Books;Horror;Paranormal, Vampires, Fantasy, Fiction, Fantasy, Paranormal, Fantasy, Supernatural, Fantasy, Urban Fantasy, Gothic, Historical, Historical Fiction, Adult;http://images.amazon.com/images/P/0345434803.01.LZZZZZZZ.jpg;;8.0;7.9375;9.0;6.9;6.0
0345434811;The Last Full Measure;Jeff Shaara;2000-01-01;Ballantine Books;Historical;Historical Fiction, Military History, Civil War, Fiction, War, Historical, American History, American Civil War, North American Hi..., American History, War, Military Fiction, Military, Military History, Novels;http://images.amazon.com/images/P/0345434811.01.LZZZZZZZ.jpg;;;6.5;;;7.0
0345435168;Open House (Oprah's Book Club (Paperback));Elizabeth Berg;2001-01-01;Ballantine Books;Fiction;Womens Fiction, Chick Lit, Contemporary, Adult Fiction, Romance, Adult, Novels, Womens Fiction, Family Law, Divorce, Audiobook;http://images.amazon.com/images/P/0345435168.01.LZZZZZZZ.jpg;;8.083333333333334;7.137931034482759;;6.0;6.666666666666667
0345439104;Drowning Ruth (Oprah's Book Club);CHRISTINA SCHWARZ;2001-01-01;Ballantine Books;Fiction;Mystery, Historical, Historical Fiction, Contemporary, Adult Fiction, Adult, Historical, Book Club, Novels, Thriller, Mystery Thriller;http://images.amazon.com/images/P/0345439104.01.LZZZZZZZ.jpg;;7.84375;7.914893617021277;9.0;8.863636363636363;7.25
