ISBN;Book-Title;Book-Author;Year-Of-Publication;Publisher;Genre Principal;Genres Secondaires;Image-URL-L;Moyenne_Adolescent 12-17;Moyenne_Adulte 26-35;Moyenne_Adulte 36-50;Moyenne_Enfant 1-12;Moyenne_Jeune adulte 18-25;Moyenne_Senior 50+
0688152023;New York City Ballet Workout : Fifty Stretches And Exercises Anyone Can Do For A Strong, Graceful, And Sculpted Body;Peter Martins;1997-01-01;Perennial Currents;Sports;Fitness, Nonfiction, Health, Reference, Anthologies, Collections, Sports, Sports, Self Help;http://images.amazon.com/images/P/0688152023.01.LZZZZZZZ.jpg;;;8.0;;;
0688168442;All About Love: New Visions (Bell Hooks Love Trilogy (Hardcover));bell hooks;2000-01-01;William Morrow & Company;Nonfiction;Feminism, Philosophy, Self Help, Writing, Essays, Love, Psychology, Relationships, Spirituality, Womens;http://images.amazon.com/images/P/0688168442.01.LZZZZZZZ.jpg;;8.0;;;;
0688171621;Naked Pictures of Famous People;Jon Stewart;1999-01-01;Perennial Currents;Humor;Nonfiction, Humor, Comedy, Writing, Essays, Short Stories, Politics, History, Anthologies, Collections, Religion, Autobiography, Memoir;http://images.amazon.com/images/P/0688171621.01.LZZZZZZZ.jpg;;8.0;9.0;;7.0;
0688172172;Phantoms in the Brain : Probing the Mysteries of the Human Mind;V. S. Ramachandran;1999-01-01;Perennial;Psychology;Science, Nonfiction, Biology, Neuroscience, Health, Medicine, Neuroscience, Brain, Science, Biology, Medical, Philosophy, Science, Popular Science;http://images.amazon.com/images/P/0688172172.01.LZZZZZZZ.jpg;;;8.0;;9.0;
0688172377;Desert Flower : The Extraordinary Journey Of A Desert Nomad;Waris Dirie;1999-01-01;Perennial;Nonfiction;Biography, Cultural, Africa, Autobiography, Memoir, Feminism, Biography, Autobiography, Eastern Africa, Somalia, Biography Memoir, Womens, Contemporary;http://images.amazon.com/images/P/0688172377.01.LZZZZZZZ.jpg;;6.5;8.0;;;
0689707495;Cloudy With a Chance of Meatballs;Judi Barrett;1982-01-01;Aladdin Library;Childrens;Picture Books, Childrens, Fiction, Fantasy, Classics, Humor, Food and Drink, Food, Kids, Childrens, Juvenile, Science Fiction Fantasy;http://images.amazon.com/images/P/0689707495.01.LZZZZZZZ.jpg;;;8.0;;10.0;10.0
0689716044;The Bears on Hemlock Mountain;Alice Dalgliesh;1992-01-01;Aladdin;Fiction;Historical, Historical Fiction, Childrens, Childrens, Chapter Books, Academic, School, Classics, Childrens, 2nd Grade, Historical, Childrens, Picture Books, Childrens, Middle Grade;http://images.amazon.com/images/P/0689716044.01.LZZZZZZZ.jpg;;;;5.0;;
068980444X;COME A STRANGER;Cynthia Voigt;1995-01-01;Simon Pulse;Young Adult;Fiction, Realistic Fiction, Young Adult, Teen, Childrens, Childrens, Middle Grade, Contemporary, Classics, Childrens, Juvenile, Literature, American;http://images.amazon.com/images/P/068980444X.01.LZZZZZZZ.jpg;;;;;7.0;
0689806167;The Moon Lady (Aladdin Picture Books);Amy Tan;1995-01-01;Aladdin;Childrens;Childrens, Picture Books, Cultural, China, Fiction, Fantasy, Cultural, Asia, Literature, Asian Literature, Audiobook, Historical, Historical Fiction, Childrens, Juvenile;http://images.amazon.com/images/P/0689806167.01.LZZZZZZZ.jpg;;10.0;10.0;;;
0689845332;Tehanu : The Earthsea Cycle;Ursula K. Le Guin;2001-01-01;Simon Pulse;Fantasy;Fiction, Young Adult, Science Fiction Fantasy, Fantasy, High Fantasy, Fantasy, Dragons, Fantasy, Magic, Science Fiction, Classics, Adventure;http://images.amazon.com/images/P/0689845332.01.LZZZZZZZ.jpg;;8.0;;;5.0;
0689845367;The Tombs of Atuan : The Earthsea Cycle;Ursula K. LeGuin;2001-01-01;Simon Pulse;Fantasy;Fiction, Young Adult, Classics, Science Fiction Fantasy, Fantasy, High Fantasy, Fantasy, Magic, Science Fiction, Adventure, Childrens;http://images.amazon.com/images/P/0689845367.01.LZZZZZZZ.jpg;3.0;;;;;
0689846177;Sagwa, The Chinese Siamese Cat;Amy Tan;2001-01-01;Aladdin;Childrens;Picture Books, Childrens, Animals, Cats, Fiction, Cultural, China, Animals, Cultural, Asia, Short Stories, Childrens, Juvenile, Literature, Asian Literature;http://images.amazon.com/images/P/0689846177.01.LZZZZZZZ.jpg;;10.0;;;;
0689847432;Alice's Adventures in Wonderland: A Pop-up Adaptation;Lewis Carroll;2003-01-01;Little Simon;Classics;Fantasy, Childrens, Childrens, Picture Books, Fiction, Adventure, Young Adult, Art, Science Fiction Fantasy, Fantasy, Fairy Tales;http://images.amazon.com/images/P/0689847432.01.LZZZZZZZ.jpg;;10.0;5.0;;;
0689851324;Homecoming;Cynthia Voigt;2002-01-01;Simon Pulse;Young Adult;Fiction, Realistic Fiction, Childrens, Middle Grade, Childrens, Contemporary, Classics, Adventure, Family, Young Adult, Teen;http://images.amazon.com/images/P/0689851324.01.LZZZZZZZ.jpg;10.0;;10.0;;;
0689854595;Remember Me 3 The Last Story;Christopher Pike;2002-01-01;Simon Pulse;Young Adult;Horror, Fiction, Fantasy, Fantasy, Paranormal, Young Adult, Teen, Paranormal, Ghosts, Fantasy, Supernatural, Thriller, Mystery;http://images.amazon.com/images/P/0689854595.01.LZZZZZZZ.jpg;9.0;;;;;
0689856741;The Call of the Wild (Aladdin Classics);Jack London;2003-01-01;Aladdin Library;Classics;Fiction, Adventure, Young Adult, Animals, Historical, Historical Fiction, Literature, Academic, School, Childrens, Novels;http://images.amazon.com/images/P/0689856741.01.LZZZZZZZ.jpg;;;;;10.0;
0689860064;Dragondrums (Mccaffrey, Anne. Harper Hall Trilogy, V. 3.);Anne McCaffrey;2003-01-01;Aladdin;Fantasy;Science Fiction, Fantasy, Dragons, Fiction, Young Adult, Science Fiction Fantasy, Adventure, Fantasy, High Fantasy, Young Adult, Teen, Adult;http://images.amazon.com/images/P/0689860064.01.LZZZZZZZ.jpg;;8.0;;;7.0;
0689860072;Dragonsinger (Harper Hall Trilogy, Volume 2);Anne McCaffrey;2003-01-01;Aladdin;Fantasy;Science Fiction, Fantasy, Dragons, Fiction, Young Adult, Science Fiction Fantasy, Adventure, Fantasy, High Fantasy, Young Adult, Teen, Adult;http://images.amazon.com/images/P/0689860072.01.LZZZZZZZ.jpg;;8.0;;;;
0691017778;The Myth of the Eternal Return: Or, Cosmos and History;Mircea Eliade;1971-01-01;Princeton University Press;Philosophy;Religion, Nonfiction, Fantasy, Mythology, History, Anthropology, Spirituality, Psychology, Religion, Theology, European Literature, Romanian Literature;http://images.amazon.com/images/P/0691017778.01.LZZZZZZZ.jpg;;9.0;;;;
0691024170;QED;Richard Phillips Feynman;1988-01-01;Princeton University Press;Science;Science, Physics, Nonfiction, Science, Popular Science, Physics, Quantum Mechanics, Science, Mathematics, Philosophy, Academic, Reference, Computer Science, Technical;http://images.amazon.com/images/P/0691024170.01.LZZZZZZZ.jpg;;9.0;;;;
0691050848;The Nature of Space and Time;Stephen Hawking;2000-01-01;Princeton University Press;Science;Science, Physics, Nonfiction, Philosophy, Science, Popular Science, Science, Astronomy, Reference, Unfinished, Space, European Literature, British Literature;http://images.amazon.com/images/P/0691050848.01.LZZZZZZZ.jpg;;10.0;;;;
069107089X;The Lives of Animals (University Center for Human Values);J. M. Coetzee;2001-01-01;Princeton University Press;Fiction;Philosophy, Animals, Academic, School, Writing, Essays, Novels, Cultural, Africa, Southern Africa, South Africa, Environment, Nature, Food and Drink, Vegan;http://images.amazon.com/images/P/069107089X.01.LZZZZZZZ.jpg;;;9.0;;;
0694524190;Edgar Allan Poe Audio Collection;Edgar Allan Poe;2000-01-01;HarperAudio;Classics;Horror, Poetry, Fiction, Short Stories, Literature, Mystery, Gothic, Fantasy, Audiobook;http://images.amazon.com/images/P/0694524190.01.LZZZZZZZ.jpg;;10.0;;;;
0694524980;Ernest Hemingway Audio Collection CD;Ernest Hemingway;2001-01-01;HarperAudio;Classics;Fiction;http://images.amazon.com/images/P/0694524980.01.LZZZZZZZ.jpg;;8.0;;;;
0717802418;Manifesto of the Communist Party;Karl Marx;1948-01-01;International Publishers;Philosophy;Nonfiction, Politics, Classics, History, Economics, Sociology, Philosophy, Theory, Politics, Political Science, European Literature, German Literature;http://images.amazon.com/images/P/0717802418.01.LZZZZZZZ.jpg;;;;;9.5;
0735200300;How to Succeed With Women;Ron Louis;1998-01-01;Prentice Hall Art;Relationships;Self Help, Nonfiction;http://images.amazon.com/images/P/0735200300.01.LZZZZZZZ.jpg;;;;;5.0;
0735611319;Code: The Hidden Language of Computer Hardware and Software;Charles Petzold;2000-01-01;Microsoft Press;Science;Computer Science, Computer Science, Programming, Nonfiction, Science, Science, Technology, Computer Science, Software, Computer Science, Computers, Computer Science, Coding, Computer Science, Technical, Science, Engineering;http://images.amazon.com/images/P/0735611319.01.LZZZZZZZ.jpg;;7.5;;;;
073571102X;Homepage Usability: 50 Websites Deconstructed;Jakob Nielsen;2001-01-01;Pearson Education;Design;Design, Usability, Nonfiction, Science, Technology, Internet, Web, Reference, Business, Design, Website Design, Computer Science, Computers, Computer Science, Technical;http://images.amazon.com/images/P/073571102X.01.LZZZZZZZ.jpg;;;7.0;;;
0736904867;Men Are Like Waffles -  Women Are Like Spaghetti;Bill Farrel;2001-01-01;Harvest House Publishers;Marriage;Nonfiction, Relationships, Christian, Self Help, Christian, Christian Non Fiction, Psychology, Christian, Christian Living, Adult, Psychology, Counselling;http://images.amazon.com/images/P/0736904867.01.LZZZZZZZ.jpg;;8.0;;;;
0738207713;Corpse: Nature, Forensics, and the Struggle to Pinpoint Time of Death;Jessica Snyder Sachs;2002-01-01;Perseus Books Group;Nonfiction;Science, Death, Crime, True Crime, History, Health, Medicine, Mystery, Crime, Medical, Reference, Reference, Research;http://images.amazon.com/images/P/0738207713.01.LZZZZZZZ.jpg;;7.0;;;;
0739427113;The Other Boleyn Girl;Philippa Gregory;2001-01-01;Scribner;Historical;Historical Fiction, Fiction, Historical, Romance, Adult, European Literature, British Literature, Romance, Historical Romance, English History, Tudor Period, Adult Fiction, Womens Fiction, Chick Lit;http://images.amazon.com/images/P/0739427113.01.LZZZZZZZ.jpg;;;9.0;;;
0740721356;Calvin and Hobbes:  Sunday Pages 1985-1995;Bill Watterson;2001-01-01;Andrews McMeel Publishing;Sequential Art;Comics, Humor, Sequential Art, Graphic Novels, Fiction, Comics, Comic Book, Sequential Art, Comic Strips, Graphic Novels Comics, Humor, Comedy, Sequential Art, Cartoon, Art;http://images.amazon.com/images/P/0740721356.01.LZZZZZZZ.jpg;;9.0;10.0;;10.0;
0740721941;Another Day In Cubicle Paradise: A Dilbert Book;Scott Adams;2002-01-01;Andrews McMeel Publishing;Humor;Sequential Art, Comics, Fiction, Sequential Art, Comic Strips, Humor, Comedy, Sequential Art, Graphic Novels, Graphic Novels Comics, Sequential Art, Sequential Art, Cartoon, Business;http://images.amazon.com/images/P/0740721941.01.LZZZZZZZ.jpg;;9.0;9.0;;8.0;
0743203046;Bowling Alone : The Collapse and Revival of American Community;Robert D. Putnam;2001-01-01;Simon & Schuster;Nonfiction;Sociology, Politics, History, Psychology, Social Science, Cultural, Culture, Society, Politics, Political Science, Philosophy;http://images.amazon.com/images/P/0743203046.01.LZZZZZZZ.jpg;;;10.0;;7.0;
0743203313;The Blackwater Lightship: A Novel;Colm Toibin;2001-01-01;Scribner;Fiction;Cultural, Ireland, European Literature, Irish Literature, LGBT, Literary Fiction, Contemporary, Novels, LGBT, Gay, LGBT, Queer, Literature;http://images.amazon.com/images/P/0743203313.01.LZZZZZZZ.jpg;;;9.0;;;
0743203593;How Right You Are, Jeeves;P.G. Wodehouse;2000-01-01;Touchstone;Fiction;Humor, Classics, Humor, Comedy, European Literature, British Literature, Audiobook, Novels, Literature, 20th Century, Historical, Historical Fiction, Literature;http://images.amazon.com/images/P/0743203593.01.LZZZZZZZ.jpg;;;9.0;;;
0743203968;The Body Artist: A Novel;Don DeLillo;2002-01-01;Scribner;Fiction;Literature, Novels, Literature, American, Contemporary, Literary Fiction, Novella, Literature, 21st Century, The United States Of America, Art;http://images.amazon.com/images/P/0743203968.01.LZZZZZZZ.jpg;;;;;2.5;
0743206053;Kitchen Privileges : A Memoir;Mary Higgins Clark;2002-01-01;Simon & Schuster;Autobiography;Memoir, Nonfiction, Biography, Biography, Autobiography, Biography Memoir, Audiobook, Adult, Suspense, History, Mystery;http://images.amazon.com/images/P/0743206053.01.LZZZZZZZ.jpg;;8.0;7.0;;8.0;8.714285714285714
0743211375;From a Buick 8 : A Novel;Stephen King;2002-01-01;Scribner;Horror;Fiction, Fantasy, Thriller, Science Fiction, Mystery, Fantasy, Supernatural, Audiobook, Fantasy, Paranormal, Novels;http://images.amazon.com/images/P/0743211375.01.LZZZZZZZ.jpg;;7.151515151515151;7.206896551724138;;7.75;8.153846153846153
0743211995;An Hour Before Daylight : Memoirs of a Rural Boyhood;Jimmy Carter;2001-01-01;Simon & Schuster;Biography;Nonfiction, Autobiography, Memoir, History, Politics, Presidents, Politics, Biography, Autobiography, Biography Memoir, North American Hi..., American History, American, Southern;http://images.amazon.com/images/P/0743211995.01.LZZZZZZZ.jpg;;8.0;;;;
0743216393;Three Plums In One : One for the Money, Two for the Dough, Three to Get Deadly;Janet Evanovich;2001-01-01;Scribner;Mystery;Fiction, Humor, Womens Fiction, Chick Lit, Romance, Mystery, Crime, Adult, Mystery, Cozy Mystery, Humor, Comedy, Contemporary;http://images.amazon.com/images/P/0743216393.01.LZZZZZZZ.jpg;;8.0;9.0;;;10.0
0743219570;Cover Her Face;P.D. James;2001-01-01;Touchstone;Mystery;Fiction, Mystery, Crime, Thriller, Mystery Thriller, Mystery, Detective, European Literature, British Literature, Audiobook, Thriller, Mystery, Murder Mystery, Adult;http://images.amazon.com/images/P/0743219570.01.LZZZZZZZ.jpg;;8.0;5.0;;7.0;
0743219619;The Black Tower;P.D. James;2001-01-01;Touchstone;Mystery;Fiction, Mystery, Crime, Mystery, Detective, European Literature, British Literature, Thriller, Mystery Thriller, Audiobook, Mystery, Murder Mystery, Suspense, Thriller;http://images.amazon.com/images/P/0743219619.01.LZZZZZZZ.jpg;;;7.0;;;
0743219635;Innocent Blood;P.D. James;2001-01-01;Touchstone;Mystery;Fiction, Mystery, Crime, Thriller, Mystery Thriller, European Literature, British Literature, Thriller, Mystery, Detective, Audiobook, Suspense, Novels;http://images.amazon.com/images/P/0743219635.01.LZZZZZZZ.jpg;;9.0;;;;
0743223136;John Adams;David McCullough;2002-01-01;Simon & Schuster;History;Biography, Nonfiction, North American Hi..., American History, Politics, Presidents, Politics, Historical, Biography Memoir, Military History, American Revolution, Audiobook;http://images.amazon.com/images/P/0743223136.01.LZZZZZZZ.jpg;;;;;5.0;
074323359X;Misery;Stephen King;2002-01-01;Fireside;Horror;Fiction, Thriller, Suspense, Mystery, Adult, Thriller, Mystery Thriller, Audiobook, Novels, Mystery, Crime;http://images.amazon.com/images/P/074323359X.01.LZZZZZZZ.jpg;;5.0;;;;
0743235010;The Doctor's House: A Novel;Ann Beattie;2003-01-01;Scribner;Fiction;Novels, The United States Of America;http://images.amazon.com/images/P/0743235010.01.LZZZZZZZ.jpg;;;5.0;;;
0743236017;Sex, Drugs, and Cocoa Puffs : A Low Culture Manifesto;Chuck Klosterman;2004-01-01;Scribner;Nonfiction;Writing, Essays, Humor, Culture, Pop Culture, Music, Cultural, Autobiography, Memoir, Sociology, Humor, Comedy, Contemporary;http://images.amazon.com/images/P/0743236017.01.LZZZZZZZ.jpg;;7.0;7.0;;;
0743243153;The Road Less Traveled, 25th Anniversary Edition : A New Psychology of Love, Traditional Values and Spiritual Growth;M. Scott Peck;2003-01-01;Touchstone;Psychology;Nonfiction, Self Help, Spirituality, Philosophy, Self Help, Personal Development, Religion, Inspirational, Relationships, Classics;http://images.amazon.com/images/P/0743243153.01.LZZZZZZZ.jpg;;8.5;10.0;;;
0743243315;Brick Lane : A Novel;Monica Ali;2004-01-01;Scribner;Fiction;Cultural, India, Contemporary, Literary Fiction, Cultural, Bangladesh, Novels, European Literature, British Literature, Literature, Book Club, Cultural, Asia;http://images.amazon.com/images/P/0743243315.01.LZZZZZZZ.jpg;;5.0;7.0;;;10.0
0743243803;The Partly Cloudy Patriot;Sarah Vowell;2003-01-01;Simon & Schuster;Nonfiction;History, Writing, Essays, Humor, Autobiography, Memoir, Politics, Audiobook, North American Hi..., American History, Short Stories, Historical;http://images.amazon.com/images/P/0743243803.01.LZZZZZZZ.jpg;;10.0;7.5;;;
074324592X;The Boat of Dreams : A Christmas Story (Preston, Richard);Richard Preston;2003-01-01;Touchstone;Holiday;Christmas, Literary Fiction, Holiday;http://images.amazon.com/images/P/074324592X.01.LZZZZZZZ.jpg;;;;;;8.0
0743249291;Wideacre : A Novel;Philippa Gregory;2003-01-01;Touchstone;Historical;Historical Fiction, Fiction, Historical, Romance, European Literature, British Literature, Romance, Historical Romance, Literature, 18th Century, Adult, Audiobook, Adult Fiction;http://images.amazon.com/images/P/0743249291.01.LZZZZZZZ.jpg;;7.0;4.0;;9.0;6.5
0743249305;The Favored Child : A Novel;Philippa Gregory;2003-01-01;Touchstone;Historical;Historical Fiction, Fiction, Historical, Romance, European Literature, British Literature, Romance, Historical Romance, Adult, Womens Fiction, Chick Lit, Audiobook, Literature, 18th Century;http://images.amazon.com/images/P/0743249305.01.LZZZZZZZ.jpg;;8.5;8.0;;;
0743251008;"Still More George W. Bushisms : \Neither in French nor in English nor in Mexican\""""";Al Franken;2003-01-01;Fireside;Humor;Nonfiction, Politics;http://images.amazon.com/images/P/0743251008.01.LZZZZZZZ.jpg;;5.0;;;;
0743253973;A Separate Peace;John Knowles;2003-01-01;Scribner;Classics;Fiction, Young Adult, Historical, Historical Fiction, Academic, School, Young Adult, Coming Of Age, Young Adult, High School, Literature, Academic, Read For School, Novels;http://images.amazon.com/images/P/0743253973.01.LZZZZZZZ.jpg;;7.0;9.0;;9.0;
0743262174;Cry, the Beloved Country (Oprah's Book Club);Alan Paton;2003-01-01;Scribner;Fiction;Classics, Cultural, Africa, Historical, Historical Fiction, Southern Africa, South Africa, Literature, Academic, School, Novels, Historical, Academic, Read For School;http://images.amazon.com/images/P/0743262174.01.LZZZZZZZ.jpg;9.0;7.1;8.666666666666666;;;8.5
0743400003;Murder On The Yellow Brick Road (Toby Peters Mysteries (Paperback));Stuart M. Kaminsky;2000-01-01;I Books;Mystery;Fiction, Mystery, Crime, Historical, Historical Fiction, Audiobook, Mystery, Detective, Mystery, Historical Mystery, Historical, Thriller, Mystery Thriller, Mystery, Cozy Mystery;http://images.amazon.com/images/P/0743400003.01.LZZZZZZZ.jpg;;7.0;;;;
0743406567;Fargo Rock City : A Heavy Metal Odyssey in Rural North Dakota;Chuck Klosterman;2002-01-01;Scribner;Music;Nonfiction, Autobiography, Memoir, Humor, Culture, Pop Culture, Writing, Essays, Biography, Cultural, Biography Memoir, Biography, Autobiography;http://images.amazon.com/images/P/0743406567.01.LZZZZZZZ.jpg;;7.0;;;;
0743411471;When Night Falls;Linda Anderson;2000-01-01;Pocket;Suspense;;http://images.amazon.com/images/P/0743411471.01.LZZZZZZZ.jpg;;9.0;;;;
0743411544;Two Brothers;Linda Lael Miller;2000-01-01;Pocket;Romance;Romance, Historical Romance, Romance, Western Romance, Westerns, Historical, Historical, Historical Fiction, Fiction, Adult Fiction, Historical Romance, Western Historical Romance, Family;http://images.amazon.com/images/P/0743411544.01.LZZZZZZZ.jpg;;;;;;5.0
074341196X;Inversions;Iain M. Banks;2001-01-01;Pocket;Science Fiction;Fiction, Fantasy, Space, Space Opera, Cultural, Science Fiction Fantasy, Adventure, Banking, Banks, Science, Technology, Speculative Fiction;http://images.amazon.com/images/P/074341196X.01.LZZZZZZZ.jpg;;7.5;;;;
0743412494;Tears;Francine Pascal;2001-01-01;Simon Pulse;Young Adult;Fiction, Science Fiction, Young Adult, Teen, Suspense, Childrens, Romance, Fantasy, Mystery, Mystery, Crime;http://images.amazon.com/images/P/0743412494.01.LZZZZZZZ.jpg;7.0;5.0;;;10.0;
0743412621;The Second Time Around : A Novel;Mary Higgins Clark;2004-01-01;Pocket;Mystery;Fiction, Suspense, Thriller, Thriller, Mystery Thriller, Mystery, Crime, Romance, Adult, Audiobook, Adult Fiction;http://images.amazon.com/images/P/0743412621.01.LZZZZZZZ.jpg;;8.333333333333334;8.0;;;7.75
0743417518;Star Trek Voyager Companion (Star Trek (Unnumbered Paperback));Paul Ruditis;2003-01-01;Star Trek;Media Tie In;Star Trek, Nonfiction, Reference, Media Tie In, Tv;http://images.amazon.com/images/P/0743417518.01.LZZZZZZZ.jpg;;;;;;10.0
0743418131;Deck the Halls (Holiday Classics);Mary Higgins Clark;2002-01-01;Pocket;Mystery;Holiday, Christmas, Fiction, Suspense, Holiday, Thriller, Mystery Thriller, Thriller, Adult, Mystery, Crime, Mystery, Cozy Mystery;http://images.amazon.com/images/P/0743418131.01.LZZZZZZZ.jpg;;6.25;8.333333333333334;;8.0;
0743418174;Good in Bed;Jennifer Weiner;2002-01-01;Washington Square Press;Womens Fiction;Chick Lit, Fiction, Romance, Contemporary, Adult Fiction, Adult, Humor, Romance, Contemporary Romance, Womens Fiction, Audiobook;http://images.amazon.com/images/P/0743418174.01.LZZZZZZZ.jpg;;8.1796875;7.950980392156863;;7.975609756097561;8.23076923076923
0743418719;Salem Falls;Jodi Picoult;2002-01-01;Washington Square Press;Fiction;Contemporary, Womens Fiction, Chick Lit, Romance, Mystery, Adult, Adult Fiction, Drama, Realistic Fiction, Novels;http://images.amazon.com/images/P/0743418719.01.LZZZZZZZ.jpg;;8.5;8.0;8.0;;8.0
0743418727;Perfect Match : A Novel;Jodi Picoult;2002-01-01;Atria;Fiction;Contemporary, Womens Fiction, Chick Lit, Drama, Adult Fiction, Adult, Mystery, Mystery, Crime, Family, Realistic Fiction;http://images.amazon.com/images/P/0743418727.01.LZZZZZZZ.jpg;;;8.0;;1.0;9.0
0743421922;Look to Windward;Iain M. Banks;2002-01-01;Star Trek;Science Fiction;Fiction, Space, Space Opera, Cultural, Science Fiction Fantasy, Space, Fantasy, Speculative Fiction, Novels, Banking, Banks;http://images.amazon.com/images/P/0743421922.01.LZZZZZZZ.jpg;;8.0;5.0;;;8.0
0743422007;God Bless You, Dr. Kevorkian;Kurt Vonnegut;2001-01-01;Washington Square Press;Fiction;Short Stories, Humor, Science Fiction, Classics, Literature, Literature, American, Writing, Essays, Adult Fiction, Fantasy;http://images.amazon.com/images/P/0743422007.01.LZZZZZZZ.jpg;;;9.0;;9.5;
0743422449;Mercy;Jodi Picoult;2001-01-01;Washington Square Press;Fiction;Contemporary, Womens Fiction, Chick Lit, Romance, Drama, Adult, Adult Fiction, Realistic Fiction, Novels, Mystery;http://images.amazon.com/images/P/0743422449.01.LZZZZZZZ.jpg;;8.0;9.0;;8.0;
0743428188;The Twentieth Wife: A Novel;Indu Sundaresan;2003-01-01;Washington Square Press;Historical;Historical Fiction, Fiction, Cultural, India, Historical, Romance, Asian Literature, Indian Literature, Cultural, Asia, Cultural, Adult, Adult Fiction;http://images.amazon.com/images/P/0743428188.01.LZZZZZZZ.jpg;;7.5;8.0;;;8.0
0743428595;Into the Woods;V.C. Andrews;2002-01-01;Pocket;Fiction;Horror, Young Adult, Romance, Gothic, Thriller, Womens Fiction, Chick Lit, Drama, Mystery, Childrens;http://images.amazon.com/images/P/0743428595.01.LZZZZZZZ.jpg;;6.0;6.0;;10.0;5.0
074343059X;Geisha of Gion: The Memoir of Mineko Iwasaki;Mineko Iwasaki;2003-01-01;Simon & Schuster (Trade Division);Nonfiction;Cultural, Japan, Biography, Autobiography, Memoir, History, Cultural, Asia, Biography, Autobiography, Asian Literature, Japanese Literature, Historical, Biography Memoir;http://images.amazon.com/images/P/074343059X.01.LZZZZZZZ.jpg;;9.0;;;9.0;
0743431014;Songs of the Humpback Whale : A Novel in Five Voices;Jodi Picoult;2001-01-01;Washington Square Press;Fiction;Contemporary, Womens Fiction, Chick Lit, Adult Fiction, Drama, Adult, Novels, Family, Audiobook, Realistic Fiction;http://images.amazon.com/images/P/0743431014.01.LZZZZZZZ.jpg;;6.0;7.0;;;
0743435389;March Upcountry;David Weber;2002-01-01;Baen;Science Fiction;Fiction, War, Military Fiction, Space, Space Opera, Science Fiction, Military Science Fiction, Fantasy, Adventure, Science Fiction Fantasy, Space, Science Fiction, Aliens;http://images.amazon.com/images/P/0743435389.01.LZZZZZZZ.jpg;;9.0;;;;7.0
0743437578;Wifey/Smart Women;Judy Blume;2001-01-01;Pocket;Fiction;Womens Fiction, Chick Lit, Contemporary;http://images.amazon.com/images/P/0743437578.01.LZZZZZZZ.jpg;;;;;8.0;
0743437810;The Vanished Man : A Lincoln Rhyme Novel (Lincoln Rhyme Novels (Paperback));Jeffery Deaver;2004-01-01;Pocket Books;Mystery;Thriller, Fiction, Mystery, Crime, Thriller, Mystery Thriller, Suspense, Mystery, Detective, Audiobook, Mystery, Murder Mystery, Adult;http://images.amazon.com/images/P/0743437810.01.LZZZZZZZ.jpg;;9.0;8.0;;8.0;9.5
0743444043;Double Dealer : Crime Scene Investigation;Max Allan Collins;2003-01-01;Pocket;Mystery;Mystery, Crime, Fiction, Thriller, Thriller, Mystery Thriller, Media Tie In, Media Tie In, Tv, Mystery, Detective, Emergency Services, Police, Suspense;http://images.amazon.com/images/P/0743444043.01.LZZZZZZZ.jpg;10.0;4.0;9.0;;9.0;
0743448944;Mount Vernon Love Story : A Novel of George and Martha Washington;Mary Higgins Clark;2003-01-01;Pocket;Historical;Historical Fiction, Fiction, Romance, Historical, Mystery, Adult, Adult Fiction, Politics, Presidents, Romance, Historical Romance, Novels;http://images.amazon.com/images/P/0743448944.01.LZZZZZZZ.jpg;;7.0;8.0;;;5.0
0743449029;Shooting Stars Omnibus : Cinnamon, Ice, Rose and Honey;V.C. Andrews;2002-01-01;Pocket;Young Adult;Fiction, Horror, Drama, Adult, Romance, Gothic, Contemporary, Anthologies, Suspense;http://images.amazon.com/images/P/0743449029.01.LZZZZZZZ.jpg;;;;;10.0;
0743454146;The Footprints of God : A Novel;Greg Iles;2004-01-01;Pocket Star;Fiction;Thriller, Mystery, Science Fiction, Suspense, Thriller, Mystery Thriller, Adventure, Novels, Mystery, Crime, Artificial Intelligence;http://images.amazon.com/images/P/0743454146.01.LZZZZZZZ.jpg;;7.666666666666667;8.166666666666666;;;8.166666666666666
0743456866;He Sees You When You're Sleeping : A Novel;Carol Higgins Clark;2002-01-01;Pocket;Mystery;Holiday, Christmas, Fiction, Thriller, Mystery Thriller, Suspense, Holiday, Thriller, Adult Fiction, Mystery, Crime, Adult;http://images.amazon.com/images/P/0743456866.01.LZZZZZZZ.jpg;;9.0;8.25;;;6.75
